Issue Number,Title,State,Created At,Updated At
1581,"Can't write command batch to channel: [id: 0x61e3267f, L:/xxxxxxxx:xxx ! R:xxxxxx/xxxxxx:6379].",closed,2018-08-07 06:54:07,2020-03-25 11:21:23
1580,Redisson stand alone giving classNotFoundException ,closed,2018-08-06 07:21:16,2018-09-05 15:56:58
1579,redisson keep sending lock request to redis due to redis cluster master-slave failover ,closed,2018-08-06 04:44:50,2020-09-17 05:59:22
1578,Why I am getting java.lang.AbstractMethodError errors?,closed,2018-08-03 14:27:12,2018-09-06 05:41:34
1577,Redisson continuously send lock request to redis after redis cluster master-slave switch,closed,2018-08-03 12:01:48,2018-08-28 19:17:59
1576,org.redisson.client.RedisTimeoutException: Redis server response timeout (3000 ms) occured for command,closed,2018-08-03 02:40:36,2018-08-03 12:31:28
1575,redisson.getNodesGroup() returns Nodes where both redis-server and redis-sentinel are not running,closed,2018-08-02 21:41:27,2019-09-23 13:20:05
1574,Jcache removeAll(Keys) Method is not working ***,closed,2018-08-01 15:56:53,2018-08-16 06:23:51
1573,Continuation to the Issue # 1562 (How to get All the Keys from org.redisson.jcache.JCache),closed,2018-08-01 11:07:38,2019-03-06 12:57:53
1572,RMapCache's addListener  become invalid,closed,2018-08-01 10:33:00,2021-08-11 05:43:11
1571,启用 EPOLL transport 异常：Caused by: java.lang.UnsatisfiedLinkError: could not load a native library: netty_transport_native_epoll_x86_64,closed,2018-08-01 07:43:24,2019-03-18 15:13:30
1570,Spring session integration error,closed,2018-08-01 03:51:22,2018-08-27 13:06:36
1569,"""RedisConnectionException: SlaveConnectionPool no available Redis entries"" even when slave is reachable and connections established.",closed,2018-07-31 07:29:09,2019-08-11 09:36:55
1568,can we have an extra API on getNodesGroup,closed,2018-07-31 02:28:59,2020-02-11 11:29:23
1567,Redis node failover triggers 30x spike in Commands to the failover shard (using RBatch object),closed,2018-07-30 22:39:24,2019-02-25 09:57:32
1566,Only Linux launch error: io.netty.handler.codec.DecoderException: CommandDecoder.decode(),closed,2018-07-30 05:49:29,2018-12-19 14:15:30
1565,ttl 用在 spring cache中，如何保证时间准确度,closed,2018-07-27 07:22:32,2018-07-27 08:29:24
1564,"Spring Cache setting TTL on keys, not working as expected",closed,2018-07-27 06:41:24,2018-07-27 08:28:44
1563,RedissonClient Get operation,closed,2018-07-25 22:27:34,2018-07-25 22:27:52
1562,How to get All the Keys from org.redisson.jcache.JCache,closed,2018-07-25 14:43:12,2018-08-01 11:05:07
1561,RTransaction Unusual Locking Problem,closed,2018-07-25 14:18:58,2018-08-14 14:16:51
1560,How to make Redisson update a cluster status with new nodes and new IPs,closed,2018-07-23 07:48:55,2019-10-30 10:21:30
1559,RBucket 不能新增数据,closed,2018-07-23 02:18:43,2018-07-24 15:19:33
1558,Getting issues while using Redisson Tomcat session manager to share one redis instance among multiple tomcats,closed,2018-07-20 19:27:49,2020-08-06 06:23:18
1557,StatusListener onUnsubscribe Not effective,open,2018-07-20 02:55:31,2018-09-05 15:55:30
1556,Introduce RSortableReactive interface,closed,2018-07-18 12:49:14,2018-07-18 13:04:41
1555,Add RGeoReactive,closed,2018-07-18 11:24:47,2018-07-18 12:07:48
1554,Add reactive version of FairLock,closed,2018-07-18 10:42:10,2018-07-18 11:14:17
1553,Add RRateLimiterReactive,closed,2018-07-18 10:25:38,2018-07-18 10:41:43
1552,Fix #1544 - global codec not registered,closed,2018-07-18 01:44:00,2018-08-01 10:42:21
1551,How to use RKeys.findKeysByPattern() with Redisson Live Object(RLO),closed,2018-07-17 21:23:09,2019-01-04 13:00:59
1550,Connection is closed per command execution for master node used as slave in readMode = MASTER_SLAVE,closed,2018-07-17 13:41:46,2018-07-18 04:06:44
1549,Connecting to AWS ElastiCache Redis in cluster mode behind NAT,closed,2018-07-16 15:38:28,2019-05-14 02:18:23
1548,Redisson threw MOVED redirection loop detected,closed,2018-07-16 03:08:52,2019-01-25 07:31:46
1547,Timezone fix while providing cron expression with timezone.,closed,2018-07-15 08:35:42,2018-08-23 12:17:39
1546,Tasks scheduled with timezone not working.,closed,2018-07-15 05:46:22,2018-08-23 12:16:34
1545,LiveObjectService - ClassCastException when using multiple ClassLoaders,closed,2018-07-14 13:56:23,2018-07-17 12:56:46
1544,Global config codec is not registered in codec cache,closed,2018-07-13 17:20:44,2018-07-19 13:41:31
1543,Implementing Job Queue,closed,2018-07-12 20:08:33,2018-07-21 18:24:22
1542,Multiple ReadLocks are not sharing locks properly after WriteLock releases,closed,2018-07-12 14:44:01,2018-09-22 11:24:02
1541,Slow Redis Sentinel Initialization on Start (update from 3.6.5 -> 3.7.3),closed,2018-07-12 09:07:10,2018-07-13 06:27:09
1540,求个demo跟springmvc整合的例子，这边应用集群部署操作redis里面的数据,closed,2018-07-12 05:32:54,2018-07-27 08:36:07
1539,Redisson stops executing commands found during tests with RBoundedBlockingQueue,closed,2018-07-11 14:24:59,2018-07-13 06:16:59
1538,aliyun redis not support,closed,2018-07-11 06:29:32,2022-05-27 03:27:59
1537,org.redisson.RedissonShutdownException: Redisson is shutdown,closed,2018-07-10 01:34:08,2019-06-03 10:43:56
1536,Scheduled task not working,closed,2018-07-09 15:22:57,2018-12-20 06:02:05
1535,HyperLogLog.addAll adds only one element,closed,2018-07-06 06:58:59,2018-07-12 10:37:49
1534,severe bug !! when sending read operation to new slave loading previous data after failover,closed,2018-07-06 05:29:30,2019-01-31 14:34:49
1533,will there be React native support ? ,closed,2018-07-05 22:50:22,2019-03-09 08:18:55
1532,Lot of connections remain in TIME_WAIT state after Redisson shutdown,closed,2018-07-05 11:44:11,2018-07-05 13:08:22
1531,why 'readonly' command is going to master everytime i send read operation at ReadMode.Master_Slave,closed,2018-07-04 14:04:18,2018-07-18 04:06:40
1530,通过Tomcat-Session-Manager管理session，访问速度特别慢,closed,2018-07-04 08:17:00,2018-12-28 10:28:34
1529,Add DUMP and RESTORE commands support,closed,2018-07-02 14:39:07,2018-07-02 15:00:50
1528,Redisson Not able to serialize and deserialize external objects?,closed,2018-07-02 13:49:29,2020-05-21 09:36:07
1527,"RSemaphore example ends up in ""Unable to decode data""",closed,2018-06-30 16:42:11,2019-04-16 16:56:25
1526,Live Object service meet NullPointerException when new field add to old RLO,closed,2018-06-29 10:55:43,2019-01-15 14:19:12
1525,分布式集群如何实现tomcat session共享,closed,2018-06-29 05:20:30,2019-08-09 14:26:23
1524,RedissonRateLimiter acquire() method blocks forever,closed,2018-06-28 21:12:00,2018-07-03 11:13:50
1523,多台物理机tomcat实例无法共享session,closed,2018-06-28 09:16:20,2018-07-11 22:03:05
1522,"Using Redis Transaction MULTI crashes in java.lang.NumberFormatException: For input string: ""QUEUED""",closed,2018-06-27 17:09:19,2018-08-08 12:37:17
1521,Feature Request: Locally cached MultiMaps,open,2018-06-27 12:47:29,2021-01-09 15:27:14
1520,tryLock 锁不住,closed,2018-06-27 02:27:32,2019-12-10 02:58:51
1519,Add iterator with batch size param to all collections,closed,2018-06-26 11:26:25,2018-06-26 11:36:17
1518,CustomObjectInputStream doesnt work for proxied classes,closed,2018-06-26 10:25:11,2018-06-26 14:48:58
1517,Support for endTime in scheduleWithFixedDelay() method?,closed,2018-06-26 08:57:38,2018-11-05 18:18:21
1516,RMap.readAllValues() returns Number as string,closed,2018-06-26 08:49:25,2018-06-27 07:59:25
1515,Not able to build redisson locally,closed,2018-06-25 14:07:56,2018-08-08 12:56:11
1514,3.7.2 SingleServer 配置问题,closed,2018-06-25 08:17:32,2019-12-24 08:10:04
1513,Mitigating Concurrency Issues ,closed,2018-06-22 15:51:38,2020-01-27 07:40:05
1512,"""URGENT""java.lang.ClassCastException:(while returning objects in nested class) Redisson gives the feature of nested object?",closed,2018-06-22 11:46:23,2018-06-23 18:25:04
1511,getClusterNodesGroup().pingAll() vs getNodesGroup().pingAll(),closed,2018-06-22 09:05:50,2018-06-25 09:22:28
1510,Do redisson store classes by creating extra keys or serialize and store in one key only?,closed,2018-06-22 08:09:19,2019-04-03 06:28:34
1509,"Exception in thread ""main"" java.lang.NoSuchFieldException: No such field: key 	at org.redisson.liveobject.misc.ClassUtils.getDeclaredField(ClassUtils.java:117) 	at org.redisson.liveobject.core.AccessorInterceptor.intercept(AccessorInterceptor.java:74) 	at src.ClientProfile$ByteBuddy$OYI3b0p1.getKey(Unknown Source) 	at src.PresenceStore.AddResourceStore(PresenceStore.java:41) 	at src.redissonmain.main(redissonmain.java:26)",closed,2018-06-22 07:34:37,2018-06-22 11:49:03
1508,Too many open file handles with Redisson 3.7.0,closed,2018-06-21 23:27:52,2019-12-09 11:54:56
1507,"In MapCache, idle timeout is not refreshed upon replace",closed,2018-06-21 22:36:49,2019-06-25 10:06:13
1506,Fixed NPE,closed,2018-06-21 14:39:16,2018-06-26 13:05:25
1505,Redisson redlock performance with azure redis cache,closed,2018-06-21 14:35:32,2018-09-05 15:58:22
1504,How to schedule one time jobs in Redisson?,closed,2018-06-21 08:19:41,2018-11-05 17:41:16
1503,How to inject taskId in runnable?,closed,2018-06-21 08:00:00,2019-11-29 14:48:01
1502,Is there a way to set ExpiryPolicy at cache entrylevel for redis jcache implementation instead of setting at the cache level ?,closed,2018-06-20 15:57:28,2019-03-09 08:03:23
1501,"How to execute some code after execution of job, something like post listeners?",closed,2018-06-20 13:21:38,2019-12-25 11:23:35
1500,How to specify start time and end time for expression?,closed,2018-06-20 12:10:02,2019-09-04 16:24:22
1499,add redisson-1.2.xsd to spring.schemas,closed,2018-06-20 11:57:25,2018-06-21 00:29:29
1498,哨兵模式高并发下lock“无效”,closed,2018-06-20 08:48:34,2018-12-20 06:11:53
1497,Missing PubSub messages when using connection ping,closed,2018-06-19 16:01:13,2019-01-29 10:18:33
1496,Redisson Class loading,closed,2018-06-19 11:19:43,2018-11-05 18:19:50
1495,Avoiding serialization/deserialization of a class.,closed,2018-06-19 09:28:17,2018-12-20 06:05:48
1494,Jobs scheduled with cron expression not running,closed,2018-06-19 07:27:08,2018-06-26 13:55:10
1493,Acquire Methods in RedissonRateLimiter Are Not Functional,closed,2018-06-19 01:52:08,2018-06-19 08:11:34
1492,Add CL.THROTTLE command for Redisson Client,closed,2018-06-18 16:17:49,2018-06-18 21:06:28
1491,Redisson not executing jobs requiring external dependencies?,closed,2018-06-18 13:02:49,2022-10-06 15:04:05
1490,Add Redis Streams support,closed,2018-06-15 10:48:02,2018-11-20 11:51:17
1489,"Warn:""Invocation of destroy method 'close' failed on bean with name 'jCacheCacheManager'""",closed,2018-06-14 01:49:15,2018-06-15 13:30:51
1488,How to provide timezone with schedule in job?,closed,2018-06-13 08:17:40,2018-12-27 03:49:01
1487,jvm create to many HashMap Nodes cause many YGC,closed,2018-06-13 07:45:34,2018-06-13 08:32:27
1486,Occasional  ERROR:Search domain query failed.  ,closed,2018-06-13 07:01:10,2019-01-23 07:08:38
1485,tryLock waitTime no valid,closed,2018-06-13 06:41:43,2018-12-30 14:05:31
1484,"do as the redisson3.7.1 RRateLimiter wiki,but it does not work!",closed,2018-06-13 03:31:42,2018-08-27 21:06:57
1483,"RedissonLocalCachedMap - ""readAll*()"" and ""values()"" methods could read from local cache only?",closed,2018-06-12 12:10:18,2019-01-07 10:39:28
1482,单节点锁不住,closed,2018-06-12 09:43:39,2018-06-27 02:20:05
1481,"Cluster Mode: Master fails over to slave, when slave fails over again redisson client retains connection to previous dead node.",closed,2018-06-11 18:31:12,2018-08-23 09:38:05
1480,Redis INFO call stopped working after 3.7.1 release,closed,2018-06-11 18:09:23,2018-06-13 10:26:06
1479,Implement RBatch commands queueing on Redis side.,closed,2018-06-11 11:05:08,2018-06-11 11:56:00
1478,Delete/modify scheduled jobs in redisson,closed,2018-06-10 13:18:53,2018-06-13 07:54:14
1477,RedissonScoredSortedSet uses wrong codec for some score methods,closed,2018-06-08 23:27:55,2018-06-11 12:14:20
1476,NullPointerException when using setPingConnectionInterval in Pub/Sub mode,closed,2018-06-08 12:56:10,2018-06-13 10:40:11
1475,RSet can not guarantee element unique.,closed,2018-06-07 06:55:54,2018-12-30 14:03:29
1474,Invert ZPOP score/element order,open,2018-06-06 09:51:56,2018-06-06 09:51:56
1473,Error while using RedissonSessionManager at tomcat(java.io.IOException: java.lang.ClassNotFoundException: org.springframework.webflow.conversation.impl.ConversationContainer),closed,2018-06-06 09:20:49,2018-07-02 10:18:02
1472,"Implement PUBSUB CHANNELS, PUBSUB NUMSUB and PUBSUB NUMPAT commands",open,2018-06-06 09:10:37,2018-12-20 08:12:34
1471,Redisson CROSSSLOT Keys in request don't hash to the same slot. channel,closed,2018-06-04 15:19:02,2018-06-26 13:31:28
1470,Redisson API to get the number of subscribers subscribed to a particular channel,closed,2018-06-04 13:08:02,2018-06-06 09:11:05
1469,How does redisson balances load among several RedissonNodes while scheduling jobs.,closed,2018-06-04 05:15:49,2019-04-06 22:09:31
1468,Redisson executing previous jobs on the schedule of newly submitted jobs.,closed,2018-06-04 05:11:34,2018-06-18 11:38:46
1467,RedissonLocalCachedMap can not init with NullPointerException,closed,2018-06-04 01:54:41,2018-06-04 09:10:05
1466,Subscribe timeout,closed,2018-05-31 08:05:01,2018-11-13 10:57:58
1465,redssion shiro jackson problem,closed,2018-05-31 01:40:25,2019-01-02 14:00:54
1464,redis session count more than visitor count,closed,2018-05-30 07:53:58,2018-09-07 14:54:28
1463,RedissonExecutorService 不能序列化DelegatingErrorHandlingRunnable,closed,2018-05-30 07:37:18,2022-11-25 06:15:19
1462,Error while using RedissonSessionManager at tomcat(java.io.IOException: java.lang.ClassNotFoundException: org.springframework.webflow.conversation.impl.ConversationContainer),closed,2018-05-29 17:55:03,2018-07-11 15:58:06
1461,Update RedissonTransactionManager.java,open,2018-05-29 08:59:04,2019-04-25 17:04:46
1460,Why RedissonTransactionManager do not support Suspend Transaction?,closed,2018-05-29 07:27:01,2019-12-16 08:24:18
1459,CommandAsyncService gets blocked at high concurrency [without OutOfMemoryError] ,closed,2018-05-28 14:22:44,2018-06-12 11:51:06
1458,ReadWriteLock timeout does not work as expected,open,2018-05-28 09:15:22,2023-05-19 09:36:03
1457,Unable to create RedissonClient,closed,2018-05-28 08:48:56,2018-06-25 09:19:03
1456,How does executor service gets associated with RedissonNode?,open,2018-05-28 04:38:50,2018-05-29 09:20:52
1455,setPingConnectionInterval for single server configuration is not propagated to underlying MasterSlaveServersConfig,closed,2018-05-24 17:44:30,2018-05-31 13:13:55
1454,ClassNotFoundException on Classes under WEB-INF/lib,closed,2018-05-24 15:59:51,2018-07-12 16:26:22
1453,Redissonnode VS ExecutorService worker,open,2018-05-24 13:18:31,2018-05-24 13:30:40
1452,Extend RScoredSortedSet object to support Redis 5.0 commands,closed,2018-05-24 12:40:52,2018-06-26 14:56:48
1451,Job distribution among several RedissonNodes.,closed,2018-05-24 10:11:54,2019-09-04 11:24:24
1450,Viewing scheduled jobs in Redisson,closed,2018-05-23 14:25:35,2019-11-22 14:11:36
1449,Default value of `threads` in Config,closed,2018-05-23 14:22:25,2018-12-26 18:58:06
1448,Some scheduled jobs not getting executed.,closed,2018-05-23 14:16:01,2018-05-28 06:35:36
1447,Redisson in cluster environment cannot use the same node when iterating a set,closed,2018-05-23 08:14:29,2018-05-23 09:32:35
1446,ElasticCache clusterserverconfig - TTL is not working as expected,closed,2018-05-22 21:39:23,2018-12-30 14:07:12
1445,RedissonRedLock algrithm improvement,closed,2018-05-21 22:52:47,2023-07-03 07:04:14
1444,Why RTransaction do not have getBuckets method?,closed,2018-05-21 12:25:27,2019-02-21 11:59:09
1443,How do I get redis server nanoTime？,closed,2018-05-21 09:52:20,2018-05-23 10:51:01
1442,RLocalCachedMap memory leak when using EvictionPolicy.WEAK,closed,2018-05-19 13:35:54,2018-11-05 18:13:05
1441,RedissonListReactive don't implement readAll and there is no method that uses LRANGE,closed,2018-05-18 23:32:00,2018-05-26 12:21:58
1440,org.redisson.client.RedisTimeoutException,closed,2018-05-18 09:00:21,2018-10-30 20:37:01
1439,NoClassDefFoundError when using FstCodec ,closed,2018-05-17 19:07:24,2018-06-01 14:06:24
1438,where can I find more example/quick start/demo ? the quick start on github too short...,closed,2018-05-17 01:08:14,2018-05-19 09:44:53
1437,redisson 不支持普通的key value结构吗？,closed,2018-05-15 01:22:52,2018-05-17 09:10:11
1436,Can I use RScript to run a lua script which inserts data into RMapCache?,closed,2018-05-12 04:48:06,2020-02-11 11:30:44
1435,Incorrect results from RBitSet.setAsync,closed,2018-05-11 09:11:55,2018-05-11 09:21:22
1434,RedisTimeoutException in RBlockingDeque,closed,2018-05-11 08:29:41,2018-05-12 06:17:46
1433,Concurrent calls to RemoteService should not result in an exception,closed,2018-05-10 21:25:44,2018-05-11 10:04:58
1432,Invalidated session in one tomcat is still used in another tomcat instance when relogin,closed,2018-05-09 17:27:55,2018-12-26 10:35:54
1431,Cannot Read Avro encoded Object from Redis after changing Java Class,closed,2018-05-09 15:54:19,2020-02-11 11:32:11
1430,can use netty3?,closed,2018-05-09 00:40:01,2018-05-11 11:46:10
1429,ClassCastException when receiving messages of different types,closed,2018-05-06 12:29:30,2018-10-17 14:04:33
1428,RemoteServiceAckTimeoutException 的问题,closed,2018-05-04 10:48:39,2018-05-23 10:51:47
1427,Spring cache not expired properly,closed,2018-05-04 09:21:38,2018-05-16 09:08:03
1426,java.lang.NoClassDefFoundError: org/redisson/RedissonLock$3$1,closed,2018-05-03 08:33:54,2018-10-30 20:37:21
1425,Feature request - I would like the ability to specify redis channel name,closed,2018-05-02 22:57:19,2018-05-08 08:46:51
1424,sentinel switch-master no work,closed,2018-05-02 14:09:17,2018-05-23 11:12:54
1423,Fix tomcat session topic update for memory replication synchronization,closed,2018-05-02 10:59:58,2019-01-25 07:18:29
1422,SSL connection to Azure redis failed,closed,2018-04-29 12:42:21,2018-05-04 13:38:38
1421,redis集群 读主的可以，读从的获取不到,closed,2018-04-28 08:32:07,2021-07-22 12:38:17
1420,Can Redisson KryoCodec default support 0-arg constructor object ,closed,2018-04-28 03:49:09,2020-02-11 11:46:22
1419,AWS ElastiCache ClusterServersConfig DNS rediscovery failure,closed,2018-04-27 07:46:50,2018-12-08 01:56:24
1418,throw exception when use RPermitExpirableSemaphore.tryAcquire,closed,2018-04-27 07:17:01,2018-12-26 18:58:17
1417,HOW TO GET REDIS TIME  IN REDISSION?,closed,2018-04-27 05:50:32,2018-04-27 11:01:22
1416,RedissonBoundedQueue expiration seems odd,closed,2018-04-26 12:37:59,2018-04-26 19:55:11
1415,setPingConnectionInterval for replicated servers configuration is not propagated to underlying MasterSlaveServersConfig,closed,2018-04-26 11:59:30,2018-04-27 11:53:05
1414,Tomcat Session replication inconsistences,closed,2018-04-26 09:07:58,2019-01-25 07:18:23
1413,"Exception in thread ""main"" org.redisson.client.RedisException: ERR unknown command eval. channel",closed,2018-04-26 05:37:11,2018-12-30 14:14:17
1412,TimeoutException,closed,2018-04-26 03:08:22,2018-05-02 11:14:15
1411,Fix proposed by Findbugs,closed,2018-04-25 13:40:05,2019-02-08 12:29:48
1410,Why RBitSet.set(...) does not return anything?,closed,2018-04-25 11:34:30,2020-10-06 08:26:46
1409,Netty 4.1.23 regression,closed,2018-04-25 10:33:27,2018-04-25 12:32:44
1408,"ConcurrentModificationException - Pub/Sub using SerializationCodec, redisson 3.6.5",closed,2018-04-25 09:21:20,2018-04-25 12:33:56
1407,Publish a request id in a redis event,closed,2018-04-24 21:08:45,2018-04-25 14:19:10
1406,getKeysByPattern is returning less number of keys in version 3.6.1,closed,2018-04-24 12:04:31,2018-05-04 12:35:19
1405,Add async methods to RLiveObjectService interface,open,2018-04-23 12:48:42,2023-05-19 09:36:02
1404,怎么设置全局的ttl和maxIdleTime啊?避免忘记清理缓存造成缓存一直存在,closed,2018-04-21 06:36:00,2021-12-23 09:59:03
1403,"文档和示例中redis的address格式错误,建议更新文档和注释.",closed,2018-04-21 04:32:26,2019-04-02 10:06:18
1402,Request org.redisson.client.RedisTimeoutException during high load,closed,2018-04-20 04:43:56,2019-12-12 03:30:31
1401,NullPointerException for RLiveObjectService.delete?,closed,2018-04-20 03:51:44,2018-04-23 12:51:15
1400,java.lang.IllegalStateException: Redisson is not in cluster mode!,closed,2018-04-20 00:27:09,2018-04-23 13:23:54
1399,setDatabase is no use,closed,2018-04-19 10:36:22,2018-04-30 13:20:12
1398,ClassCastException with StringCodec while testing non sticky session on Tomcat,closed,2018-04-19 07:09:47,2018-04-20 09:32:04
1397,Can't update cluster state,closed,2018-04-19 05:47:35,2018-04-30 13:20:37
1396,java.lang.NoSuchMethodError java/lang/CharSequence,closed,2018-04-18 04:00:27,2018-11-06 19:43:43
1395,PermitExpirableSemaphore to be able to make expirable permit to a normal permit,closed,2018-04-17 12:19:36,2018-09-21 14:35:46
1394,'reconnectionTimeout' setting in unavailable. Please use 'failedSlaveReconnectionInterval' setting instead!,closed,2018-04-17 01:22:42,2018-06-01 08:41:16
1393,RMI Garbage Collection in Redis,closed,2018-04-16 23:06:15,2018-05-16 13:29:16
1392,Introduce BatchOptions object,closed,2018-04-16 11:35:28,2018-04-16 12:32:13
1391,Redisson: Why reactive client doesn't have PermitExpirableSemaphore?,closed,2018-04-16 09:08:21,2018-04-16 11:13:52
1390,Implement Spring Transaction API,closed,2018-04-13 10:20:13,2018-04-13 10:21:50
1389,About select db,closed,2018-04-13 10:12:29,2018-04-13 13:20:54
1388,Frequent timeout with RedisLabs multi-proxy setup,closed,2018-04-12 21:07:25,2018-04-23 11:44:34
1387,RScheduledExecutorService使用中发现的问题,closed,2018-04-12 10:06:27,2018-05-01 13:10:23
1386,throw exception when use redissonClient.getPermitExpirableSemaphore function,closed,2018-04-12 05:21:01,2018-04-30 13:07:29
1385,RedissonSortedSet does not implement ZRANGE commands,closed,2018-04-11 07:12:37,2018-04-13 12:58:57
1384,RMI starts to lose ability to send commands,closed,2018-04-11 00:31:27,2018-04-13 06:02:56
1383,org.redisson.client.RedisException: ERR unknown command ' EVAL ',closed,2018-04-10 11:58:40,2018-04-10 12:16:24
1382,Redis server response timeout (3000 ms),closed,2018-04-10 03:08:02,2018-11-13 10:21:52
1381,about getList implement,closed,2018-04-09 12:39:49,2018-04-09 15:06:51
1380,RList value in a RLocalCachedMap returns RedissonReference,open,2018-04-09 12:06:24,2018-04-26 13:48:35
1379,Why no RMapCacheAsync::fastReplace?,closed,2018-04-06 15:20:54,2018-04-17 17:18:04
1378,[CRITICAL] Redisson cluster sync failed,closed,2018-04-06 12:56:23,2018-04-09 07:39:20
1377,Unhandled DecoderExceptions deplete Netty pool,closed,2018-04-06 12:36:14,2018-04-09 07:12:59
1376,What is difference between Rmap and RLocalCachedMap,closed,2018-04-06 06:26:32,2018-04-09 10:05:28
1375,RSet returned by RSetMultimap.get() does not update multimap correctly.,closed,2018-04-05 22:47:19,2018-04-09 06:17:03
1374,Spring Boot Starter implementation,closed,2018-04-05 15:00:12,2018-09-15 09:30:38
1373,Spring Data integration,closed,2018-04-05 14:59:41,2018-08-27 11:36:29
1372,Add Transaction API,closed,2018-04-04 11:27:26,2018-04-23 07:41:28
1371,RAtomicLong.expireAt会改变缓存值,closed,2018-04-04 09:53:57,2018-04-04 10:23:50
1370,ERROR [io.netty.util.ResourceLeakDetector] - LEAK:,closed,2018-04-04 01:18:45,2019-11-01 06:49:18
1369,RedissonScoredSet - contains/remove method - equals and hashcode?,closed,2018-04-02 08:44:37,2018-04-02 11:12:56
1368,RedisTimeoutException when I register remoteservice,closed,2018-04-02 07:08:16,2018-04-04 10:18:45
1367,Java 10 support,closed,2018-03-30 15:25:36,2018-04-16 09:45:57
1366,Redisson connected to sentinels works fine - But throws the following error,closed,2018-03-29 10:22:33,2018-03-29 10:57:22
1365,"put  RMap or RLocalCachedMap ,return null, is not sync!!!",closed,2018-03-29 09:30:53,2019-05-20 06:11:16
1364,"Consecutive ""Subscribe timeout"" for topics utilizing same AsyncSemaphore lock",closed,2018-03-28 23:25:09,2018-11-13 10:57:33
1363,Is this a bug,closed,2018-03-28 09:54:13,2018-03-29 07:22:20
1362,DecoderException after upgrade to latest version 3.6.3,closed,2018-03-27 21:22:42,2018-03-29 15:37:15
1361,Redisson-tomcat in a multi-tenant environment Logs: ERROR io.netty.util.HashedWheelTimer - You are creating too many HashedWheelTimer instances.,closed,2018-03-26 15:16:30,2019-01-15 17:03:20
1360,Cannot construct instance of `org.javamoney.moneta.internal.JDKCurrencyAdapter`,closed,2018-03-25 12:32:22,2018-03-27 07:23:24
1359,"IllegalStateException: availableProcessors is already set to [8], rejecting [8]",closed,2018-03-25 11:43:36,2023-03-01 06:54:50
1358,哪个codec支持LocalDateTime/LocalDate？,closed,2018-03-24 11:40:00,2023-05-04 09:21:31
1357,method putAll throws map value can't be null,closed,2018-03-23 08:51:18,2018-03-23 22:27:55
1356,two thread get  the same   RedissonMultiLock  ?,closed,2018-03-23 08:31:22,2018-05-13 06:33:34
1355,单机升级集群出现的问题,closed,2018-03-23 07:37:26,2018-03-28 23:36:51
1354,how to create a custome id generator in hibernate,closed,2018-03-23 04:36:15,2019-03-09 08:17:08
1353,Fair lock vs regular lock,closed,2018-03-22 16:43:33,2020-05-30 05:23:30
1352,"Bug Pub/Sub: Skip result + Execute batch - RedisException: ERR Syntax error, try...",closed,2018-03-21 17:32:50,2018-03-22 07:25:32
1351,Can't execute SENTINEL commands on /,closed,2018-03-21 12:57:24,2018-04-04 10:17:01
1350,NPE in CommandDecoder handler while using RBatch object,closed,2018-03-21 07:02:35,2018-03-21 07:04:48
