Issue Number,Title,State,Created At,Updated At
2751,Tomcat valves need to check getNext() if it is not null first,closed,2020-05-05 15:08:05,2020-05-12 06:52:07
2750,Node for slot: 14296 hasn't been discovered yet. Check cluster slots coverage using CLUSTER NODES command,closed,2020-05-05 13:54:12,2020-06-11 08:17:10
2749,Distributed scheduled executor service ,closed,2020-05-05 00:31:15,2020-05-06 06:20:34
2748,Command execution timeout for command: (SENTINEL GET-MASTER-ADDR-BY-NAME),closed,2020-05-04 18:31:04,2020-10-07 05:26:48
2747,masterConnectionPoolSize cannot limit the maximum connection pool size,closed,2020-05-04 07:12:56,2020-05-12 10:50:27
2746,DNS monitoring for cluster mode,closed,2020-05-04 05:57:14,2020-05-05 07:39:12
2745,redisson主从分离搭建,closed,2020-05-03 05:24:14,2020-05-06 01:09:40
2744,Connections are not dropped even idle time is larger than idleConnectionTimeout,closed,2020-05-01 23:13:08,2020-05-12 10:51:38
2743,Can't connect to server for AWS ElastiCache Redis,closed,2020-04-30 18:14:03,2020-05-02 04:30:38
2742,Implement TimeSeries structure.,closed,2020-04-30 10:01:43,2020-05-12 06:20:04
2741,How to custom rules of acquire lock,closed,2020-04-30 03:39:07,2020-04-30 06:55:39
2740,Idle connection is not killed after timeout,closed,2020-04-30 00:54:00,2020-04-30 20:47:35
2739,"On sentinel failover, connections to the new master are getting doubled",closed,2020-04-30 00:45:59,2020-04-30 06:09:18
2738,How does redisson determine the number of connections to Redis,closed,2020-04-29 20:10:35,2020-05-04 07:33:44
2737,Redisson cannot reconnect to Redis cluster after Redis service is bounced,closed,2020-04-29 19:53:04,2020-06-04 09:24:00
2736,org.redisson.tomcat.RedissonSessionManager.findSession Session can't be found,closed,2020-04-29 09:56:12,2020-05-21 08:40:08
2735,Different DB of same redis instance share session among tomcat instances which belong  to different apps?,closed,2020-04-29 09:41:22,2022-09-07 14:33:19
2734,how to use Redisson Lock if lua 'eval' is forbiddened in Redis Cluster because of not good support ?,closed,2020-04-29 07:24:26,2020-04-29 08:07:29
2733,Bucket cast exception：java.lang.Long cannot be cast to org.redisson.client.protocol.decoder.ListScanResult,closed,2020-04-29 01:26:55,2020-05-27 06:14:48
2732,Node not discovered,closed,2020-04-28 22:00:24,2020-04-29 07:51:17
2731,Problem of 'java.util.Collections$SetFromMap' already exist in V3.12.4,closed,2020-04-28 07:59:04,2020-04-29 08:34:01
2730,Get multiple delayed queues of one queue,open,2020-04-28 07:04:43,2020-04-28 07:07:04
2729,"In a sentinel configuration, the configuration subscriptionMode.SLAVE does not seem to work",closed,2020-04-26 16:39:47,2020-04-26 18:58:11
2728,Connection Pool refresh. Redis ips keep changing. ,closed,2020-04-25 10:52:51,2020-10-14 09:21:30
2727,`tryLock` in redis cluster working not properly,closed,2020-04-24 09:15:46,2020-04-24 11:36:30
2726,Question about retryAttempts&retryInterval,closed,2020-04-24 03:04:00,2020-04-24 07:09:36
2725,JbossMarshallingRiver Codec implementation corrupts objects serialized in the thread which had a serialization exception before,closed,2020-04-23 17:57:14,2020-04-24 05:46:30
2724,RBlockingQueue延时队列到期不能poll到值。是不是我的使用方式有问题。,closed,2020-04-23 10:36:43,2021-05-12 02:24:37
2723,RedissonSessionRepository.loadSession fail when there is an empty attribute in session,closed,2020-04-23 08:00:06,2020-04-23 08:56:34
2722,Use MarshallingCodec by default,closed,2020-04-23 07:43:37,2020-06-29 15:12:26
2721,org.redisson.client.RedisException: Unexpected exception while processing command,closed,2020-04-23 05:31:38,2020-08-05 11:44:45
2720,Master fail over with AWS ElastiCache with ReplicatedServersConfig ,closed,2020-04-23 02:12:34,2020-04-30 06:00:23
2719,Storing UUID objects is impossible ?,closed,2020-04-22 20:15:36,2021-01-11 07:56:08
2718,RedissonReactiveClient getLock and getLexSortedSet is executing on different thread.,closed,2020-04-22 17:06:50,2020-04-23 07:29:26
2717,tomcat8集成redission后，AAP运行后生成很多FastThreadLocalThread对象，不久OOM,closed,2020-04-22 14:11:14,2020-08-01 17:58:39
2716,Rbatch String values pre append \x00\,closed,2020-04-22 08:45:21,2020-04-23 09:13:18
2715,MapLoader and TTL,closed,2020-04-22 07:03:32,2022-10-01 14:31:01
2714,RedissonLock.tryLock() interrupted and keep renew lock,closed,2020-04-21 16:12:14,2022-06-15 13:22:33
2713,Redisson fastRemove not working in AWS Lambda,closed,2020-04-21 09:55:20,2020-04-27 06:30:18
2712,RSetReactive contains not full equals,closed,2020-04-21 09:10:01,2020-04-22 08:52:22
2711,About asynchronous methods in RMapCache,closed,2020-04-20 16:17:46,2020-04-21 10:09:31
2710,Events per client,open,2020-04-20 14:44:05,2020-04-20 14:44:05
2709,#2702 Fix RedissonReactiveStringCommands.set using wrong SET RedisCommand,closed,2020-04-20 14:06:19,2020-04-21 07:42:41
2708,"Cache not working for hibernate collection, that is joined by non primary key field",closed,2020-04-19 22:02:20,2020-04-23 07:22:52
2707,"Failover with Elasticache cluster causes excessive failures, RedisNodeNotFoundException",closed,2020-04-18 00:01:37,2020-09-24 06:19:01
2706,error in RedissonBoundedBlockingQueue,closed,2020-04-17 10:01:17,2021-05-19 13:06:58
2705,org.redisson.client.RedisResponseTimeoutException,closed,2020-04-17 09:58:09,2020-05-11 06:00:58
2704,"wheather use the shared instance or a new one, when getting reids object every time ? ",closed,2020-04-17 09:03:13,2020-04-20 05:46:07
2703,#2702 Fix RedissonReactiveStringCommands.set returning Boolean as result,closed,2020-04-16 18:30:44,2020-04-21 07:44:55
2702,ReactiveValueOperations#set result calls onComplete directly without offering Boolean value,closed,2020-04-16 16:30:17,2020-04-21 07:43:12
2701,A lot of threads waiting on “org.redisson.spring.data.connection.RedissonConnection.sync”,closed,2020-04-16 13:06:46,2022-08-01 05:10:23
2700,"I don't want redisson connect to some specific nodes in redis cluster, can I do it?If yes, how?",closed,2020-04-16 00:33:46,2020-04-16 06:12:13
2699,Simplifying debugging of sentinel connection problems,closed,2020-04-15 13:14:31,2021-02-10 12:43:37
2698,publish return 0 when redisson as client,closed,2020-04-15 02:53:41,2020-04-18 02:13:48
2697,ClosedChannelException during RPUSH and BLPOP,closed,2020-04-15 02:00:47,2020-08-28 12:34:15
2696,SessionExpiredEvent and SessionDestroyedEvent,closed,2020-04-14 17:45:51,2020-04-14 19:06:04
2695,Spring session timeout,closed,2020-04-14 17:38:14,2020-04-16 10:02:32
2694,RedissonSession#changeSessionId - PTTL and stale map fixes,closed,2020-04-13 20:48:27,2020-04-15 17:16:27
2693,RedissonSession retains reference to wrong map after changeSessionId,closed,2020-04-13 20:46:03,2020-04-15 06:33:57
2692,RedissonSession#changeSessionId expiredKey race condition,closed,2020-04-13 20:45:53,2020-04-15 05:27:09
2691,Fixed - RedissonSessionRepository topic listener NPE race,closed,2020-04-13 20:00:19,2020-04-15 17:16:01
2690,RedissonSessionRepository topic listeners initialization has race condition,closed,2020-04-13 19:59:06,2020-04-14 05:42:00
2689,延迟队列有消费端的用例么,closed,2020-04-13 13:09:26,2020-04-15 05:28:46
2688,Best method to zero-out Bloomfilter,closed,2020-04-11 23:56:59,2020-04-14 05:40:19
2687,publish  message  throw exception,closed,2020-04-11 10:23:39,2020-04-11 11:47:41
2686,RedissonReactiveSubscription is not initialized properly and as a result - no messages are handled,closed,2020-04-11 09:07:45,2020-09-28 05:04:14
2685,ClassCastException between BatchResult<?> and List<Boolean>,closed,2020-04-10 20:03:10,2020-04-11 14:56:15
2684,"Elasticache and Clustered Redis, question about Configuration Endpoint",closed,2020-04-10 18:42:05,2020-04-13 08:00:27
2683,Error: java.lang.ClassCastException: class org.redisson.api.BatchResult cannot be cast to class java.util.List,closed,2020-04-10 14:52:55,2020-04-11 05:39:42
2682,Unable to find master entry for local.db.xxx.xx.com/10.80.xxx.xx:6379. Multiple IP bindings for single hostname supported only in Redisson PRO!,closed,2020-04-10 10:21:13,2020-04-24 06:17:07
2681,ERROR reactor.core.scheduler.Schedulers:319 : Scheduler worker in group main failed with an uncaught exception,closed,2020-04-09 05:39:45,2020-04-13 08:05:09
2680,RedissonConnection#del() doesn’t participate in pipeline ,closed,2020-04-09 05:32:03,2020-04-09 13:38:15
2679,Redisson is unable to start if first sentinel node in list is down,closed,2020-04-08 06:44:59,2020-04-10 05:54:46
2678,RedisNodeNotFoundException after failover in AWS Elasticache,closed,2020-04-08 05:32:24,2020-12-15 09:11:36
2677,RTopic.countListeners() unexpected result,closed,2020-04-07 08:40:10,2020-04-07 12:10:49
2676,RLiveObjectService  search conditions not working as expected,closed,2020-04-07 08:29:08,2020-04-13 08:29:04
2675,How does Redisson handle concurrent requests?,closed,2020-04-06 09:09:45,2023-07-19 22:19:30
2674,Do we have support for Micronaut framework,closed,2020-04-06 07:07:51,2021-06-14 07:05:48
2673,Exception after upgrading to redisson 3.12.4,closed,2020-04-06 06:41:42,2020-04-06 07:53:30
2672,The idle connection does not be released after redis cluster failover.,closed,2020-04-06 05:20:28,2020-05-06 07:12:52
2671,Sentinelconnectionmanageris not correctly in IPv6 dual stack environments,closed,2020-04-04 04:33:50,2021-08-24 07:31:22
2670,RRateLimiter delete,closed,2020-04-03 15:26:00,2020-04-07 05:41:47
2669,Improve RLock reliability during failover and deprecate RedLock,closed,2020-04-03 10:30:17,2020-04-03 10:38:03
2668,use redisson make jvm old generation overflow,closed,2020-04-02 11:21:40,2020-07-03 05:37:52
2667,about reading from replicas,closed,2020-04-01 15:28:09,2020-04-03 10:41:20
2666,DB count not decreased as expected.,closed,2020-03-30 15:09:49,2020-04-01 06:44:31
2665,RLock throws java.lang.IllegalMonitorStateException in the thread where got the lock twice ,closed,2020-03-30 08:44:55,2020-04-07 04:08:40
2664,Making readGroup and claim as read-write methods,closed,2020-03-30 06:02:11,2020-03-30 06:35:56
2663,Redisson considers XREADGROUP and XCLAIM commands as read only but redis considers them read-write commands not allowing these commands to be executed on read-only replica,closed,2020-03-30 05:31:21,2020-03-30 07:04:47
2662,Redisson error when create client,closed,2020-03-28 16:31:56,2020-03-30 06:28:15
2661,Use the session map’s codec when getting the map,closed,2020-03-27 20:53:22,2020-04-01 23:05:37
2660,FstCodec exception when copying session map in changeSessionId,closed,2020-03-27 20:53:10,2020-03-30 06:39:24
2659,Use FSTConfiguration#deriveConfiguration to preserve ConfType,closed,2020-03-27 20:36:09,2020-04-01 23:05:48
2658,FstCodec copy constructor doesn’t preserve ConfType of FSTConfiguration,closed,2020-03-27 20:32:04,2020-03-29 05:21:58
2657,Fix Spring Data connector to set multiGet (MGET) commands to slave in…,closed,2020-03-27 18:25:06,2020-03-28 05:37:31
2656,Spring Data connector sends multiGet (MGET) commands to master instead of slave,closed,2020-03-27 18:15:59,2020-03-28 05:37:56
2655,Possible solution for #2592,closed,2020-03-27 09:07:54,2020-06-19 09:24:48
2654, Unable to decode data...InvalidDefinitionException..Collections$SetFromMap..no Creators,closed,2020-03-27 08:15:19,2020-03-27 08:44:23
2653,RedissonReactiveClient not saving data to Redis,closed,2020-03-26 16:29:29,2020-03-27 04:52:14
2652,Introduce new API to manage Redis nodes,closed,2020-03-26 09:03:25,2020-03-26 10:33:33
2651,RedissonBoundedBlockingQueue drainTo method got infinite hung,closed,2020-03-24 09:01:35,2020-04-20 09:46:13
2650,Is it possible to restrict session loading/saving to specific requests?,closed,2020-03-23 15:59:51,2020-03-25 15:30:39
2649,RedisPipelineException-WriteRedisConnectionException-invalid commands,closed,2020-03-23 02:41:00,2020-04-09 13:26:54
2648,Distlock Mutual exclusion problem ？,closed,2020-03-23 01:50:50,2020-03-23 05:20:33
2647,Question about PingConnectionInterval and KeepAlive,closed,2020-03-22 22:24:23,2020-03-26 11:18:43
2646,decodeInExecutor=true isn’t compatible with certain replays,closed,2020-03-21 06:08:14,2020-03-30 09:01:48
2645,RExecutorService - Some tasks won't get executed ,closed,2020-03-20 16:00:07,2020-05-27 13:23:30
2644,Redisson Configuration For AWS ElastiCache ,closed,2020-03-20 10:51:52,2020-03-22 09:42:48
2643,java.io.IOException: Failed to read the next byte,closed,2020-03-19 19:16:08,2020-03-31 06:39:13
2642,RMapCache adds some special characters before,closed,2020-03-19 09:10:50,2022-04-19 13:46:16
2641,tomcat 7.0.100 can not load META-INF/services/javax.servlet.ServletContainerInitializer file of webApp jars,closed,2020-03-18 10:44:11,2020-03-19 02:08:17
2640,"why tomcat 7.0.100 can not load files in directory ""META-INF/services/"" of spring-web",closed,2020-03-18 10:21:43,2020-03-18 10:50:21
2639,"question with RBlockingQueue.poll(timeout, TimeUnit.SECONDS)",closed,2020-03-18 05:27:59,2023-07-12 14:45:23
2638,Implement Spring Cloud connector,open,2020-03-16 16:17:37,2020-05-22 05:53:12
2637,Update README.md,closed,2020-03-16 16:01:08,2020-06-19 09:26:27
2636,LEAK: HashedWheelTimer.release() was not called before it's garbage-collected.,closed,2020-03-16 09:32:54,2020-03-17 06:20:06
2635,Can't construct a java object for org.redisson.codec.JsonJacksonCodec,closed,2020-03-16 08:35:10,2022-09-10 22:16:12
2634,Add username support to AUTH command,closed,2020-03-16 07:21:22,2020-03-16 09:14:30
2633,Why setUseLinuxNativeEpoll has been removed from the config?,closed,2020-03-15 23:22:31,2020-03-16 05:28:16
2632,Overriding toString() method on a live object breaks the object.,open,2020-03-13 16:15:10,2020-04-07 05:58:27
2631,Why is BaseConfig package protected,closed,2020-03-11 07:31:07,2020-03-16 08:23:15
2630,Update dependency to address Vulnerability CVE-2017 18640 that remains since the last update,closed,2020-03-10 21:26:21,2020-03-16 16:52:15
2629,Does entrySet with count support sorting?,closed,2020-03-10 16:14:05,2020-03-16 08:25:40
2628,org.redisson.client.RedisResponseTimeoutException: Redis server response timeout (6000 ms) occured after 3 retry attempts.,closed,2020-03-09 07:04:16,2020-03-16 08:25:56
2627,ARGV[1] get nil when run lua script  through redissonClient.getScript().eval(),closed,2020-03-09 06:30:16,2020-03-09 07:56:58
2626,Add NettyHook object,closed,2020-03-06 08:06:45,2020-03-06 08:15:48
2625,Reddison live Object as RExpired not correctly clean up index,closed,2020-03-06 04:12:36,2023-05-25 10:31:32
2624,support parsing config file in utf8 encoding with bom,closed,2020-03-05 06:42:36,2020-03-16 08:26:17
2623,getPatternTopic not working,closed,2020-03-04 23:56:02,2020-03-05 11:32:05
2622,Redisson entity invalidation with JCache CreatedExpiryPolicy,closed,2020-03-04 15:58:09,2020-03-05 06:39:10
2621,ERR unknown command 'AUTH' while connecting sentinel,closed,2020-03-02 04:45:45,2020-03-05 04:12:03
2620,Inconsistent library versions reminder.,open,2020-03-02 01:39:20,2020-03-02 01:39:20
2619,RMapCache Cache expiration on a cluster of Redisson clients,closed,2020-02-29 23:29:51,2020-03-16 08:29:55
2618,RRateLimiter cannot update settings,closed,2020-02-28 14:24:42,2021-06-29 07:27:07
2617,Can RRateLimiter create permits evenly,closed,2020-02-28 14:14:34,2021-03-17 10:55:18
2615,A WARNING,closed,2020-02-27 08:40:03,2020-03-16 08:31:17
2614,Add RxJava3 implementation,closed,2020-02-26 07:02:55,2020-11-11 15:31:00
2613,"In a frequent job , sometime lock.tryLock() can not get lock",closed,2020-02-25 15:10:58,2020-02-28 05:28:28
2612,Add Caffeine as alternative local cache implementation,closed,2020-02-25 11:20:56,2020-02-26 07:15:43
2611,Make JCacheManager constructor public,closed,2020-02-25 11:10:43,2021-01-12 05:18:56
2610,RPriorityQueue should extend RQueue and RPriorityDeque should extend RDeque,closed,2020-02-24 08:39:33,2020-02-24 08:53:54
2609,Does any form of visibility / metrics / eventing require Redisson Pro,closed,2020-02-23 01:51:22,2020-02-23 07:40:51
2608,Auto-Reconnect to a Modifed Elasticache Cluster,closed,2020-02-21 13:00:21,2020-04-23 09:51:40
2607,Add RPUSHX and LPUSHX commands support,closed,2020-02-21 09:25:03,2020-02-21 09:58:08
2606,Add SWAPDB command support,closed,2020-02-21 08:34:26,2020-02-21 09:24:21
2605,Add RBinaryStreamReactive and RBinaryStreamRx objects,closed,2020-02-21 08:26:47,2020-02-21 08:28:05
2604,Add RBucketsReactive and RBucketsRx objects,closed,2020-02-21 07:35:58,2020-02-21 07:41:58
2603,RBinaryStream should expose SeekableByteChannel and AsynchronousByteChannel interfaces,closed,2020-02-20 11:14:56,2020-02-21 06:51:13
2602,"Add field ""name"" to RedissonCache",closed,2020-02-20 05:10:55,2020-07-01 14:03:59
2601,Memory leak when using cluster mode to read by RBatch,closed,2020-02-20 04:17:05,2020-02-24 09:16:47
2600,`addAndGet` operation fail on `RMap` with write-behind mode enabled,open,2020-02-19 23:17:50,2023-05-19 09:36:07
2599,warnings coming from dependent library fst,closed,2020-02-19 22:25:32,2020-02-20 06:40:41
2598,Update dependency to adress Vulnerability CVE-2017 18640,closed,2020-02-19 17:38:28,2020-02-20 14:33:40
2597,Memory leak or misconfigured,closed,2020-02-19 17:12:00,2020-02-20 14:20:00
2596,"tryLock()，Machines are not evenly distributed, and one server never gets the lock",closed,2020-02-19 08:26:19,2020-02-20 07:44:31
2595,Map EntryExpiredListener ,closed,2020-02-19 04:24:32,2020-04-06 06:50:02
2594,Listener question (about Lists),closed,2020-02-18 17:16:40,2020-04-13 08:02:32
2593,JCacheEventCodec fails to read class name causing ClassNotFoundException,closed,2020-02-18 14:24:42,2020-02-19 06:21:27
2592,Is it possible to destroy session on deserialization issue?,closed,2020-02-18 05:27:52,2022-10-05 14:06:11
2591,"onConnect, onDisconnect seem doesn't work as expected",closed,2020-02-16 05:26:38,2021-04-29 09:05:41
2590,What happens when Locks are not released because of a thread terminate/crash ,closed,2020-02-14 08:59:00,2021-08-19 09:53:13
2589,Redisson does not propogate security principal,closed,2020-02-13 14:16:39,2020-04-15 12:55:35
2588,'java.lang.IndexOutOfBoundsException' exception in org.redisson.jcache.JCacheEventCodec,closed,2020-02-13 09:38:28,2020-02-18 08:54:18
2587,broken connections on the pool,closed,2020-02-13 08:48:14,2020-02-17 12:42:12
2586,Client randomly timeout and won't recover,closed,2020-02-13 03:08:00,2020-02-20 07:17:57
2585,RPermitExpirableSemaphore and RSemaphore,closed,2020-02-12 15:29:43,2020-02-12 16:33:26
2584,Writing to RLocalCachedMaps is seeding the data to redis,closed,2020-02-12 08:13:45,2020-03-10 10:14:39
2583,spring data redis to redisson api,closed,2020-02-12 08:10:07,2020-02-26 09:24:44
2582,Unable to decode data with NullPointer,closed,2020-02-11 16:45:55,2020-02-27 05:41:33
2581,Behaviour of RPermitExpirableSemaphore,closed,2020-02-10 20:30:28,2020-02-11 11:50:15
2580,Add TTL on Comparator,closed,2020-02-10 08:54:04,2020-02-11 11:06:31
2579,"I find a bug about Redisson,when I use it to set data into redis server.",closed,2020-02-08 08:38:14,2020-02-08 09:39:22
2578,PR for issue #2555,closed,2020-02-07 10:05:43,2021-03-28 05:07:33
2577,PR for issue #2555,closed,2020-02-07 09:59:36,2020-02-07 10:00:53
2576,How to know if RedissonMap is created at redis end ,closed,2020-02-07 09:29:53,2020-02-07 13:33:49
2575,RedissonLock fails to unsubscribe from channel when a lock is acquired,closed,2020-02-07 08:29:07,2020-02-17 13:22:00
2574,redisson.cache.ReferenceCacheMap causes OOM..,closed,2020-02-06 03:43:07,2020-04-20 01:54:36
2573,PR for issue #2555,closed,2020-02-06 02:24:05,2020-02-07 10:08:03
2572,PR for issue #2555,closed,2020-02-06 02:16:23,2020-02-06 02:21:07
2571,My PR for issue #2555,closed,2020-02-06 02:01:01,2020-02-06 02:13:58
2570,How do i specify default permits when creating semaphore object with RMap,closed,2020-02-05 17:00:07,2020-02-06 13:46:41
2569,Reading stream throws IndexOutOfBoundsException,closed,2020-02-05 15:04:38,2020-03-16 08:31:41
2568,Cache performance is less when compared to map.,closed,2020-02-05 07:22:48,2020-03-09 07:33:00
2567,Unable to initialize JCache using Redisson's config object,closed,2020-02-04 14:29:21,2020-02-04 18:49:33
2566,Unable to unlock  when thread isInterrupted,closed,2020-02-04 08:33:08,2021-02-11 06:11:53
2565,Change session id without renaming key,closed,2020-01-29 20:59:34,2020-02-07 13:53:07
2564,How to properly load redisson dependencies inside a jar file,closed,2020-01-28 13:51:08,2020-02-18 17:20:14
2563,Perform Sentinel DNS check when all connections fail,closed,2020-01-28 13:23:02,2020-01-29 12:04:51
2562,Dynamically setting TTL,closed,2020-01-28 00:56:27,2020-01-31 06:37:58
2561,zCount 0/-1 instead of -inf/+inf,closed,2020-01-27 21:52:14,2020-01-28 09:47:46
2560,Distributed scheduled executor service with Spring Boot,closed,2020-01-24 15:08:58,2023-03-20 09:23:52
2559,Command still hasn't been written into connection?,closed,2020-01-24 09:39:56,2023-03-22 15:06:42
2558,java.lang.NoClassDefFoundError: org.redisson.misc.RedissonPromise,closed,2020-01-23 12:01:42,2021-06-29 07:25:20
2557,Can you use a service to lock and unlock threads?,closed,2020-01-22 16:59:36,2020-01-28 10:15:47
2556,Unable to remove lock automatically,closed,2020-01-22 07:07:23,2020-01-28 10:16:01
2555,Cycled RLO objects with cause RCascadeType.PERSIST infinite loop and stuck,open,2020-01-22 01:44:29,2020-02-06 02:34:24
2554,Improve Redisson Eviction Rate,closed,2020-01-21 14:47:26,2020-01-30 08:58:07
2553,delay queue doesn't work after one of cluster node occur master slave switch,closed,2020-01-21 10:40:21,2020-06-15 08:41:26
2552,Master/Slave mode with master only writer and slaves as reader,closed,2020-01-21 05:51:55,2020-03-05 06:53:51
2551,RLock.unlock() results in ERR hash value is not an integer,closed,2020-01-20 20:45:27,2020-02-20 07:19:39
2550,Crash connection Redis,closed,2020-01-20 13:57:51,2020-01-29 10:12:33
2549,ElastiCache/Redis - RedisConnectionException and RedisResponseTimeoutException,closed,2020-01-19 18:15:19,2020-02-11 11:20:57
2548,java.net.MalformedURLException: Invalid host,closed,2020-01-19 09:19:06,2020-01-20 06:35:11
2547,there are dead locks in redis,closed,2020-01-19 05:23:12,2020-01-29 10:13:08
2546,"java.lang.IllegalMonitorStateException: attempt to unlock lock, not locked by current thread by node id: 6e3d30b7-83b1-433a-9335-5e8b9916d3ac thread-id: 731",closed,2020-01-19 01:07:00,2020-01-19 06:45:17
2545,Implement port mapping for sentinel and reported master,closed,2020-01-17 14:26:19,2020-01-29 05:40:00
2544,lock.isHeldByCurrentThread() verification  before unlocking Exception,closed,2020-01-17 09:50:20,2020-03-05 06:53:28
2543,RLock unlock always throw an exception what like 'not lock by current thread',closed,2020-01-16 05:39:22,2020-01-16 08:05:01
2542,Does the Redisson（BLPOP） support multily key？,closed,2020-01-14 15:03:08,2020-01-14 16:47:09
2541,运行时打印错误日志,closed,2020-01-14 07:15:38,2020-01-14 09:18:02
2540,Add an auto configuration customizer,closed,2020-01-13 10:14:59,2020-03-30 12:16:03
2539,Memory Leak in SentinelConnectionManager,closed,2020-01-13 09:45:30,2020-01-28 13:23:25
2538,数据类型问题,closed,2020-01-13 07:40:33,2020-01-13 09:01:23
2537,RRateLimiter allows permits query,closed,2020-01-12 03:34:22,2020-01-15 08:03:29
2536,Updating from 3.8.2 to 3.12.0 breaks,closed,2020-01-12 02:21:54,2020-01-12 19:26:03
2535,"""RedisConnectionException: SlaveConnectionPool no available Redis entries"" even when the slaves are reachable and connections established",closed,2020-01-10 22:54:58,2022-10-13 08:16:56
2534,Fix for issue #2528 Now always extracting scheme from url for sentinel connections,closed,2020-01-09 10:19:48,2020-01-09 13:35:59
2533,Fix for #2528 Connection to password protected Sentinel,closed,2020-01-09 09:55:02,2020-01-09 10:12:00
2532,关于redisson的watchdog重连机制,closed,2020-01-09 09:03:59,2020-01-10 08:44:45
2531,java.lang.ClassCastException: java.lang.Double cannot be cast to java.lang.Float,closed,2020-01-09 06:33:39,2020-01-09 09:52:06
2530,Delay job execute time is not correct when use RDelayedQueue,closed,2020-01-09 03:20:30,2020-10-01 07:44:11
2529,redisson-spring-boot-starter RedissonAutoConfiguration customizer,closed,2020-01-08 13:54:08,2022-04-06 09:21:08
2528,"Connecting to a password protected Redis Sentinel fails, due to scheme not being forwarded",closed,2020-01-08 11:18:36,2020-01-09 13:36:20
2527,How to build from source and package as single jar without all optional dependency?,closed,2020-01-08 10:04:47,2020-01-21 08:14:47
2526,外网访问redis集群 myself节点ip变成内网的,closed,2020-01-08 09:56:01,2020-01-09 02:01:11
2525,Add tryExecute and tryExecuteAsync methods to RRemoteService object,closed,2020-01-07 09:37:53,2020-01-07 09:40:26
2524,Deserialization the object from redis to RList throws InvocationTargetException,closed,2020-01-07 09:19:40,2020-01-07 09:38:19
2523,Deserialization the object from redis to RList throws InvocationTargetException,closed,2020-01-07 09:19:40,2020-02-11 11:26:13
2522,Subscriptions become zombies when network lost,closed,2020-01-07 07:59:27,2020-01-08 04:41:53
2521,How to dynamically fetch node addresses from AWS Elasticache?,closed,2020-01-06 10:39:13,2020-01-07 06:45:42
2520,How can i merge redisson.yml and spring-application.yml,closed,2020-01-06 08:59:07,2020-01-21 08:21:22
2519,有没有办法统一设置给所有锁加统一的前缀？,closed,2020-01-05 16:55:36,2020-01-09 14:36:28
2518,Expiration renewal stops working after connection timeout #2515,closed,2020-01-05 01:00:11,2020-01-05 08:33:28
2517,Add sbt dependency to readme,closed,2020-01-04 15:51:49,2020-01-05 08:34:44
2516,With spring boot application redisson by default connect to local host even after providing configuration,closed,2020-01-04 06:46:05,2020-01-07 06:45:57
