Issue Number,Title,State,Created At,Updated At
5288,RedisTimeoutException: Unable to acquire connection and Redisson is shutdown,open,2023-08-30 21:56:32,2023-08-30 22:44:32
5287,How to configure ssl Unidirectional authentication,closed,2023-08-30 08:55:24,2023-08-30 10:46:32
5286,[Redisearch] Vector field not support to set alias when create index with JSON schema,closed,2023-08-30 08:18:36,2023-08-30 10:34:57
5285,RSorted Map comparator not working correctly,open,2023-08-30 07:29:11,2023-08-30 11:24:42
5284,RediSearch can not create Vector field,closed,2023-08-30 02:21:48,2023-08-30 04:31:51
5283,Redisson Keys throwing 'KryoException: Encountered unregistered class ID:',closed,2023-08-29 20:18:27,2023-08-29 22:02:30
5282,Unable to send command! Node source,open,2023-08-29 12:53:53,2023-09-01 03:38:53
5281,Parameter 0 of constructor in com.barns.redis.*required a bean of type 'org.redisson.Redisson' that could not be found.,open,2023-08-26 09:32:38,2023-09-01 06:25:47
5280,Class not found exception with FSTCodec,closed,2023-08-25 23:35:12,2023-08-26 17:01:23
5279,"When using blockQueue with Redisson, other commands may experience blocking.",open,2023-08-25 10:39:55,2023-08-29 11:54:55
5278,RediSearch: Error when creating a JSON TAG field index with both SORTABLE and CASESENSITIVE options set,closed,2023-08-25 07:20:38,2023-08-28 07:33:51
5277,org.springframework.dao.QueryTimeoutException: Redis server response timeout (3000 ms) occured after 0 retry attempts,closed,2023-08-25 04:40:37,2023-08-25 12:44:56
5276,ClusterConnectionManager.this.getLastPartitions() appear out of memory,open,2023-08-24 08:17:55,2023-08-24 10:51:25
5275,NullPointerException with Redisson on Struts Based App,closed,2023-08-22 19:03:04,2023-08-28 19:14:50
5274,springboot引入redisson依赖报错,closed,2023-08-22 13:34:15,2023-08-25 12:21:29
5273,Support sprint boot @ServiceConnection annotation in tests,closed,2023-08-22 07:59:41,2023-08-28 06:30:31
5272,Add WAITAOF command support,closed,2023-08-22 04:35:36,2023-08-22 04:38:18
5271,The stream queue documentation is too sparse to use at all,open,2023-08-22 03:56:45,2023-08-22 04:51:10
5270,Why bloomfilter max size is Integer.MAX_VALUE*2,open,2023-08-22 01:48:03,2023-09-02 16:16:29
5269,"Redisson throws ""org.redisson.client.RedisConnectionException: SlaveConnectionPool no available Redis entries."" and doesn't recover",open,2023-08-21 17:39:55,2023-08-22 13:00:03
5268,How to set the hash slot or node about specific key?,closed,2023-08-21 06:34:06,2023-08-21 08:07:47
5267,Empty initialisation sequence error when using JNDI with RedissonClient connection,open,2023-08-20 04:31:47,2023-08-20 04:34:29
5266,延迟队列到时间不消费，后端服务重启后才消费,closed,2023-08-19 16:14:10,2023-08-22 06:40:07
5265,redis中使用jdk编码获取的key和value 怎样使用redisson设置值，具体代码实现怎样的,closed,2023-08-19 11:56:33,2023-08-21 01:01:37
5264,Eviction after crash,closed,2023-08-19 11:35:11,2023-08-19 17:55:06
5263,redisson 怎样给key和value分别设置序列化，redis中可以setKeySerializer和setValueSerializer，redisson中怎样具体实现,closed,2023-08-19 11:05:03,2023-08-21 08:01:32
5262,Protobuf support,closed,2023-08-18 16:58:22,2023-08-22 15:49:42
5261,Protobuf support,closed,2023-08-18 16:21:59,2023-08-21 05:39:16
5260,Protobuf support,closed,2023-08-18 16:10:43,2023-08-21 05:39:57
5259,What is the recommended value of retryAttempts parameter?,closed,2023-08-18 04:03:41,2023-08-21 08:09:32
5258,how to config redisson in spring boot starter ?,closed,2023-08-18 01:49:03,2023-08-18 06:59:23
5257,RScheduledExecutorService with native image compile，java.lang.NoSuchMethodException writeReplace(),closed,2023-08-17 03:06:42,2023-08-21 08:11:13
5256,lock with isCheckLockSyncedSlaves() (WAIT),closed,2023-08-16 11:37:31,2023-08-16 12:51:14
5255,"Unable to acquire connection, disappears after a period of stable operation",closed,2023-08-16 11:32:08,2023-08-23 08:45:17
5254,Why RScheduledExecutorService not provide method getTask by taskId,open,2023-08-16 06:24:18,2023-08-16 06:24:18
5253,RedissonBoundedBlockingQueue  delete  bug,closed,2023-08-15 13:29:48,2023-08-21 08:00:26
5252,RedissonBoundedBlockingQueue   delete   bug,closed,2023-08-15 13:27:54,2023-08-15 14:38:54
5251,RedisClientConfig & Redisson Config from environment,open,2023-08-15 10:00:46,2023-08-30 03:44:42
5250,does `MapWriter` acquire distributed lock?,closed,2023-08-13 15:07:36,2023-08-15 05:57:12
5249,Fix possible memory leak in JsonJacksonCodec during warmup,closed,2023-08-13 12:05:22,2023-08-14 08:40:05
5248,Does redisson-3.23.2 support redis-7.0.23 ?,closed,2023-08-13 06:40:32,2023-08-15 05:57:21
5247,Feature: multiple permit RedissonPermitExpirableSemaphore,closed,2023-08-11 12:57:39,2023-08-24 07:40:23
5246,docs: redisson-spring-data downgrade steps for gradle,open,2023-08-11 10:50:58,2023-08-22 08:53:28
5245,Migrating to newer Version,closed,2023-08-11 06:54:15,2023-08-20 05:11:56
5244,Detached,closed,2023-08-10 21:02:50,2023-08-10 21:03:16
5243,Cache Long as strings in CommandEncoder in order to reduce allocations and improve performance,closed,2023-08-10 19:48:52,2023-08-15 10:47:51
5242,"How do I get a value from RTimeSeries<V,L> when I added using RTimeSeries<V> object. ",closed,2023-08-10 15:12:49,2023-08-20 05:11:39
5240,[ISSUE #5235]add aop lock annotation,open,2023-08-10 06:41:54,2023-08-23 05:46:28
5239,[ISSUE #5235]add aop lock annotation,closed,2023-08-10 06:23:43,2023-08-10 06:41:40
5238,How do I set different serialization rules for key and value?,closed,2023-08-09 16:33:52,2023-08-10 15:49:56
5237,Failed to start bean 'redisPubsubContainer'; nested exception is java.lang.NoClassDefFoundError: org/springframework/data/redis/connection/zset/Tuple,closed,2023-08-09 15:49:58,2023-08-11 10:52:34
5236,Connection fails with enabled lazyLoading feature,closed,2023-08-09 07:15:39,2023-08-14 04:43:39
5235,add aop to use lock quickly in spring,open,2023-08-09 03:47:20,2023-08-09 03:47:20
5234,Increased connections and Unable to acquire connection for subscription after upgrading to 3.23.2,closed,2023-08-08 17:06:30,2023-08-10 14:19:46
5233,Getting startup error when trying out TomcatSessionManager,closed,2023-08-08 08:51:48,2023-08-15 05:57:59
5232,"Hope to support protobuf, Use protostuff to generate dynamically",closed,2023-08-08 08:20:48,2023-08-08 08:25:34
5231,Unique jsessionid with more than one tomcat,closed,2023-08-07 15:55:02,2023-08-07 16:25:20
5230,"Caused by: java.lang.NullPointerException: Cannot enter synchronized block because ""this.mutex"" is null",closed,2023-08-07 09:00:12,2023-08-07 09:17:18
5229,Create Cache Issue -Multi Node issue,closed,2023-08-04 00:22:24,2023-08-15 18:40:03
5228,How to set codec in redisson-spring-data-27,closed,2023-08-03 04:19:53,2023-08-15 05:58:12
5227,"Client returns `""PONG""` for some cache keys after experiencing `RedisTimeoutException`, causing `ClassCastException` (+ potential memory leak?)",closed,2023-08-03 01:59:11,2023-08-24 00:46:43
5226,Reduce regex compilations in RedisURI,closed,2023-08-02 14:55:07,2023-08-03 16:05:40
5225,Redisson command get stuck after Redis failure,closed,2023-08-02 12:14:07,2023-08-02 14:18:50
5224,Does Redisson have WRITE_THROUGH and WRITE_BEHIND retry mechanism?,open,2023-08-02 10:15:42,2023-09-01 06:05:25
5223,end,closed,2023-08-02 01:37:31,2023-08-07 07:00:16
5222,Each AddressResolver uses a different DNSCache instance,closed,2023-08-01 16:08:50,2023-08-02 04:51:51
5221,Is it normal that a thread can get the lock before lease time had past?,closed,2023-08-01 14:44:13,2023-08-13 12:03:47
5220,"Why is it that when I use RedissonMultiLock, when a redis machine breaks down, the lock cannot be used all the time, and I need to reconnect the broken machine before I can continue to use it",closed,2023-08-01 12:09:03,2023-08-10 12:17:06
5219,Unable to acquire subscription lock after upgrading to Redisson 3.23.1,open,2023-08-01 10:19:40,2023-08-01 10:19:40
5218,Why the Exception happened when i unlock the lock?,open,2023-08-01 08:58:24,2023-08-01 08:58:24
5217,Unable to send PING command over channel,open,2023-08-01 08:41:27,2023-08-23 06:12:35
5216,[BitMap] Bitset not support get(Long ...x1),open,2023-08-01 06:26:52,2023-08-08 04:46:52
5215,why cancel connectionFuture?,closed,2023-08-01 03:51:16,2023-08-02 06:18:41
5214,Recommendation when using sticky sessions on tomcat,open,2023-07-31 20:44:47,2023-07-31 20:44:47
5213,Reflection Issue since release 3.23.1 with Quarkus native build,closed,2023-07-31 14:46:14,2023-08-15 07:57:22
5212,Issue with serializing third-party library class without default constructor using Redisson and Jackson,open,2023-07-31 12:26:02,2023-08-04 12:59:38
5211,tomcat9 is not running with redisson,closed,2023-07-31 11:47:05,2023-08-01 12:11:29
5210,keepAlive and tcpNoDelay,open,2023-07-31 11:18:44,2023-07-31 11:18:44
5209,Bloom filter is not initialized error,open,2023-07-31 09:10:21,2023-07-31 09:30:25
5208,RLocalCachedMap reconnectionStrategy setting doesn't work with SyncStrategy.Update,open,2023-07-31 07:10:37,2023-07-31 07:10:37
5207,Sync all data from Redis map into local cache map using RLocalCachedMap,closed,2023-07-31 07:04:11,2023-08-10 15:56:38
5206,Do LOCALCACHE StoreMode in RedissonLocalCachedMap guarantee eventual consistency between Redisson clients?,closed,2023-07-30 10:28:32,2023-07-31 07:09:52
5205,RLock cannot be aquired after failover in cluster mode,open,2023-07-28 15:22:23,2023-07-28 15:27:15
5204,How to monitor drift/replication lag between nodes in LocalCachedMap?,closed,2023-07-28 10:24:01,2023-08-10 15:58:31
5203,"Setting RetryAttempts to 0, always throws an exception",closed,2023-07-27 16:35:08,2023-07-28 04:08:23
5202,Use redisson 3.10.6 problem,open,2023-07-27 10:54:17,2023-07-27 11:16:21
5201,RedissonLocalCachedMap.putAllOperationAsync class java.lang.Integer cannot be cast to class io.netty.buffer.ByteBuf,closed,2023-07-27 07:53:40,2023-07-28 09:46:09
5200,Use RExecutorService get a bug,closed,2023-07-27 07:48:30,2023-07-28 05:01:51
5199,PubSub channels should be reconnected back to Slave from Master node if SubscriptionMode = SLAVE,closed,2023-07-27 07:37:41,2023-07-27 07:47:20
5198,RLocalCacheMap remove method hangs if called inside transaction,open,2023-07-26 19:03:27,2023-08-17 05:58:42
5196,iterating ListMultiMap,open,2023-07-25 18:29:07,2023-07-27 10:32:28
5195,Why not Support protobuf,closed,2023-07-25 06:15:32,2023-08-22 15:49:57
5194,RLocalCachedMap with SentinelConnectionManager sometimes fail to reattach topic after Failover,closed,2023-07-25 03:09:24,2023-07-27 08:15:19
5192,StackOverflowError in AggregationOptions.groupBy() due to recursion,closed,2023-07-22 05:30:59,2023-07-22 05:40:14
5191,NullPointer when trying to access activeviews in JSF,closed,2023-07-20 16:03:03,2023-07-21 05:45:43
5190,Elasticache : Unable to use cluster configuration endpoint,closed,2023-07-20 14:26:40,2023-08-17 05:59:00
5189,Elasticache connectivity issue when the cluster goes in to recovery for patch,closed,2023-07-20 14:20:24,2023-08-21 08:10:42
5188,ReadWriteLock readLock and RLock Same Name Lock Issue,closed,2023-07-20 07:09:07,2023-07-20 07:21:04
5187,java.lang.ClassCastException: class org.redisson.remote.RemoteServiceResponse cannot be cast to class org.redisson.remote.RemoteServiceAck,open,2023-07-20 04:43:01,2023-08-24 06:48:05
5186,Remove trailing whitespace,closed,2023-07-18 22:17:16,2023-08-10 06:59:11
5185,io.netty.handler.ssl.NotSslRecordException when connecting to Elasticache ,closed,2023-07-18 16:04:41,2023-07-21 05:49:27
5183,Use SUBSCRIBE instead of PSUBSCRIBE in LocalCacheListener,closed,2023-07-18 10:49:00,2023-08-09 07:37:31
5182,Micronaut 4.0 integration,closed,2023-07-18 08:54:53,2023-07-18 08:58:07
5181,"Using RMapCacheReactive's Mono < V > put (K key, V value, long ttl, TimeUnit unit) and Mono < V > get (K key); method, Mono does not continue to perform subsequent subscriptions",closed,2023-07-18 07:45:57,2023-07-21 05:48:33
5180,Reduce the scope of key event subscriptions for RLiveObjectService,closed,2023-07-18 05:22:40,2023-07-18 05:25:17
5179,Reduce the scope of key event subscriptions,closed,2023-07-17 20:33:59,2023-08-09 04:31:20
5178,Subscription registration timeout exceeded,open,2023-07-17 18:52:08,2023-07-21 16:00:02
5177,calling putIfAbsent twice times out after upgrading to 3.23.0 ,closed,2023-07-17 16:10:04,2023-08-16 13:34:13
5174,sharded pub sub message order,closed,2023-07-17 10:43:23,2023-07-27 10:35:01
5173,Issue with keys missing from RLocalCachedMap ,open,2023-07-17 05:11:51,2023-07-17 10:06:29
5172,Unexpected delays when using RDelayedQueue,open,2023-07-16 04:17:16,2023-07-16 04:17:16
5171,Connection and ConnectionPool,closed,2023-07-15 05:46:59,2023-07-15 06:28:41
5170,Feature - Netty native transport for `io_uring`,closed,2023-07-15 03:56:31,2023-08-07 07:00:44
5169,Support for `io_uring` via `TransportMode`,closed,2023-07-14 07:12:22,2023-08-07 07:00:38
5168,"Unable to acquire connection, it seems like a stubborn problem",closed,2023-07-14 03:17:48,2023-07-14 14:28:56
5167,bucket.addListener增加的过期监听器，在key过期后不会被清理,open,2023-07-13 02:45:20,2023-08-25 01:31:01
5166,Redis server response timeout,closed,2023-07-12 14:00:08,2023-07-17 01:31:27
5165,Is there a multiset implementation,closed,2023-07-11 14:27:00,2023-07-27 05:37:36
5164,MasterSlaveConnection - RedissonLocalCachedMap wrong RoundrobinLoadBalance when creating topic,open,2023-07-10 14:12:33,2023-07-11 09:39:17
5163,Issue of forced float type of addAndGetOperationAsync() in RedissonMap,closed,2023-07-10 13:25:09,2023-07-17 07:30:37
5162,"How to set up can completely solve the following error, and there are many errors in the log:",closed,2023-07-10 09:39:35,2023-07-27 12:35:08
5161,Introduce MapCacheOptions object with removeEmptyEvictionTask() method.,closed,2023-07-10 08:52:11,2023-07-10 08:53:13
5160,Bump h2 from 2.1.210 to 2.2.220 in /redisson-hibernate,closed,2023-07-07 21:54:23,2023-07-08 07:43:38
5158,"Possible memory leak, in RMapCache with evictionScheduler workflow, Redisson - 3.15.x",closed,2023-07-06 11:53:31,2023-07-25 05:06:54
5157,RExecutorService's task response should be deleted if task was canceled,closed,2023-07-06 07:33:40,2023-07-06 07:34:29
5156,"Command execution timeout for command: (AUTH), params: (password masked) - Redisson client",closed,2023-07-06 02:34:38,2023-07-10 06:42:36
5155,How to convert kryo5 object to string in redis function?,closed,2023-07-05 17:01:32,2023-07-12 05:16:56
5154,RedisConnection `close()` private but mentioned in documentation,closed,2023-07-05 06:18:53,2023-07-06 05:08:38
5153,Bug fix: #5152,closed,2023-07-05 05:55:54,2023-07-06 08:04:35
5152,Unit Test failures,closed,2023-07-05 05:36:19,2023-07-10 07:05:50
5151,Connection selection algorithm to minimize number of connections needed,open,2023-07-05 04:01:10,2023-08-01 12:56:39
5150,Bug fix: #5148,closed,2023-07-04 12:47:48,2023-07-06 11:38:47
5149,geo exception,closed,2023-07-04 09:55:45,2023-07-10 06:43:39
5148,Canceling tasks that scheduled with cron expression does not interrupt the thread,closed,2023-07-04 02:34:59,2023-07-06 10:32:31
5147,Code Review - Behaviors of FixedRate and FixedDelay should be similar in TasksRunnerService,open,2023-07-04 01:55:16,2023-07-06 08:06:46
5146, java.lang.ClassCastException: class org.redisson.remote.RemoteServiceResponse cannot be cast to class org.redisson.remote.RemoteServiceAck (org.redisson.remote.RemoteServiceResponse and org.redisson.remote.RemoteServiceAck,open,2023-07-03 10:06:11,2023-08-24 07:42:02
5145,"引入redis的发布订阅,出现异常",closed,2023-07-03 06:00:36,2023-07-03 06:19:50
5144,Missed methods implementation of Spring Data Redis module,closed,2023-07-03 04:59:34,2023-07-03 05:01:35
5143,Unable to cancel a task scheduled at fixed rate,closed,2023-07-03 04:08:43,2023-07-03 09:34:14
5142,spring boot 2.6.4 with redisson 3.17.1 : zRevRangeByLex command will throw StackOverflow error,closed,2023-07-01 07:27:02,2023-07-03 05:01:51
5141,RMap with MapLoader - how to control parallelism in loadAll,open,2023-06-29 11:51:21,2023-06-29 11:52:28
5140,spring boot集成redisson3.22.1后，项目启动正常，几分钟之后netty的DnsNameResolver不停地重复打印warn日志，似乎进入了死循环,closed,2023-06-29 06:05:47,2023-06-29 09:07:05
5139,"Fix ""Redis settings in redisson-spring-boot-starter README is deprecated.""(#5138)",closed,2023-06-29 02:30:04,2023-06-29 03:59:15
5138,Redis settings in redisson-spring-boot-starter README is deprecated.,closed,2023-06-29 02:26:51,2023-06-29 04:12:53
5137,Fallback to TCP for DNS Truncation,closed,2023-06-28 17:59:42,2023-06-29 03:56:08
5136,引入本框架最新本后项目报错无法运行,closed,2023-06-28 12:44:34,2023-06-28 16:09:17
5135,redisson是否支持spring native编译?,closed,2023-06-28 06:07:10,2023-07-18 06:28:08
5134,Redisson3.17.7 LRUCacheMap出现内存泄漏原因？,closed,2023-06-28 03:42:34,2023-06-29 05:17:33
5133,nested exception is org.redisson.client.RedisException: Unexpected exception while processing command,closed,2023-06-28 02:33:09,2023-06-29 05:49:42
5132,Quarkus 3 native image failed to build with Redisson,closed,2023-06-27 21:40:20,2023-07-14 07:48:18
5131,RedisException / UnsupportedOperationException on RMap.fastRemove when used with transaction,closed,2023-06-27 12:12:27,2023-06-29 05:46:24
5130,Add RBloomFilter contains() and add() methods with element collection support,closed,2023-06-27 07:16:58,2023-06-27 07:22:26
5129,RedissonBloomFilter,closed,2023-06-27 01:25:19,2023-06-27 04:59:18
5128,"Incorrect handling ""unknown command"" response for RTopic operations.",closed,2023-06-26 10:40:27,2023-06-26 10:59:36
5127,RTransaction::getBucket should throw error when it is subsequently called within one transaction using different codecs,open,2023-06-26 09:34:21,2023-06-26 09:41:45
5126,RMapCache and RLocalCachedMap should use sharded pubsub in Redis Cluster 7.0+,closed,2023-06-26 08:57:02,2023-06-26 09:01:11
5125,RMapCache shouldn't emit events if no listeners added,closed,2023-06-26 06:44:36,2023-06-26 06:47:53
5124,ConcurrentModificationException while writing into the RMapCache,closed,2023-06-23 15:43:47,2023-06-26 11:02:31
5123,keepPubSubOrder setting isn't used,closed,2023-06-23 08:34:10,2023-06-23 08:34:47
5122,RedisException while deserializing ListMultimapCache eviction results,closed,2023-06-23 07:27:23,2023-06-23 08:29:16
5121,Map entrySet and Maps entries,closed,2023-06-22 16:23:31,2023-06-22 18:04:50
5120,RMultimapCache eviction after remove by key&value,closed,2023-06-22 14:35:03,2023-06-23 08:27:30
5119,Codec Issue when upgrading from version 3.18.1 to 3.19.0,closed,2023-06-21 21:47:21,2023-06-29 05:51:37
5118,"Since upgrading redisson-hibernate-53 from 3.18 to any newer version, we have errors in deserialization",closed,2023-06-21 03:29:42,2023-06-29 09:10:43
5117,pubsub subscriber OOM,closed,2023-06-20 08:40:57,2023-07-15 06:33:06
5116,RLock tryLock times out on a Redis cluster running with clustered mode,open,2023-06-19 17:47:07,2023-07-04 07:50:40
5115,Is it possible for a watchdog to be alive on its own?,open,2023-06-19 10:58:16,2023-06-19 10:58:16
5114,RLO delete by id not cleaning up indexed fields.,closed,2023-06-19 08:22:06,2023-06-19 09:23:35
5113,ConcurrentModificationException occasionally thrown during batch set,closed,2023-06-19 06:59:59,2023-07-07 06:30:02
5112,Retrieving parent live object by nested indexed field?,closed,2023-06-16 10:52:15,2023-06-16 19:28:08
5111,Bump snappy-java from 1.1.9.1 to 1.1.10.1 in /redisson,closed,2023-06-15 16:22:27,2023-06-16 06:26:27
5110,Bump snappy-java from 1.1.9.1 to 1.1.10.1 in /redisson-all,closed,2023-06-15 16:21:55,2023-06-15 16:32:53
5109,LocalCachedMapOptions.cacheSize = -1 should disable data storage,closed,2023-06-15 09:51:44,2023-06-15 09:52:17
5108,Fixed: issue #5098 - RRateLimiter#setRate does not behave as expected,closed,2023-06-15 09:32:58,2023-06-15 10:02:14
5106,"RedissonSearch search(), error report ""Parameters must be specified in PARAM VALUE pairs""",closed,2023-06-15 02:49:45,2023-06-15 06:57:54
5105,[Question] RedisGraph compatibility,open,2023-06-14 15:28:23,2023-06-14 15:29:00
5104,[Question] Massive messages expired at same time cause Redis server halting when using DelayedQueue,open,2023-06-13 10:43:49,2023-07-05 08:09:03
5103,Redisson Live Object; Fields annotated with @RIndex not persisted; Collections not cleaned up,closed,2023-06-13 10:12:41,2023-06-16 07:40:40
5101,docs : change readme typo rediss -> redis,closed,2023-06-10 11:42:54,2023-06-10 11:57:01
5100,Fix ClassCastException from MonoNext to Flux,closed,2023-06-09 09:34:55,2023-06-13 09:04:24
5099,Fixed wait time handling in RedissonSpinLock #5002,closed,2023-06-09 08:33:57,2023-06-10 13:58:47
5098,RRateLimiter分布式限流BUG: 不会删除ZSET数据结构的key。,closed,2023-06-09 06:16:58,2023-06-15 10:02:30
5097,redissonClient & redisTemplate 序列化有没有兼容方案,closed,2023-06-09 04:12:44,2023-06-10 05:38:23
5096,Redisson connecting to a cluster fails to recover after temporary outage,closed,2023-06-09 04:06:26,2023-06-10 05:42:51
5095,Netty conflicts,closed,2023-06-09 03:22:45,2023-06-10 07:09:20
5094,java.lang.ClassCastException: class reactor.core.publisher.MonoNext cannot be cast to class reactor.core.publisher.Flux,closed,2023-06-08 12:30:05,2023-06-13 09:04:33
5093,inactive property added to StreamConsumer object,closed,2023-06-08 09:04:30,2023-06-08 09:05:03
5092,"maxDeletedEntryId, entriesAdded, recordedFirstEntryId properties added to StreamInfo object",closed,2023-06-08 09:03:49,2023-06-08 09:05:14
5091,"in cluster mode,the cluster-state check has one hard to find flaw should be avoid。",open,2023-06-08 07:05:45,2023-06-19 09:09:19
5090,Apache Tomcat Manager and Micronaut Session store should use sharded pubsub in Redis Cluster 7.0+,closed,2023-06-07 06:02:43,2023-06-07 06:27:12
5089,Default getCache method checks for Object class equality,closed,2023-06-06 16:43:08,2023-06-08 09:26:03
5088,No route to host exception is  observed in SentinelConnectionManager after redis version is upgraded ,closed,2023-06-06 14:32:23,2023-07-17 09:55:34
5087,Difference between sentinel and replicated mode,closed,2023-06-06 09:09:26,2023-07-27 10:36:26
5086,"Memory leak, when using RLocalCachedMap and TypedJsonJacksonCodec",closed,2023-06-05 19:37:22,2023-06-07 06:24:40
5085,Getting RedissonShutdownException: Redisson is shutdown,closed,2023-06-05 14:58:09,2023-07-04 07:57:21
5084,Live object detach time-consuming problem,closed,2023-06-05 10:30:44,2023-07-04 08:46:30
5083,Add entriesRead parameter to RStream.createGroup method,closed,2023-06-05 05:08:21,2023-06-05 05:45:36
5081,Make MKSTREAM optional when creating consumer group.,closed,2023-06-02 19:24:32,2023-06-05 05:45:27
5080,"Service integration redisson (3.16.6) It takes a long time to execute the command for the first time after each restart of the service, timeout, and it will be normal after the second time",closed,2023-06-02 06:27:30,2023-06-29 06:27:26
5079,"Fixed - The error log ""Unable to unfreeze entry... "" loop forever when sentinel slave pod IP in k8s changed #5078",closed,2023-06-02 05:05:23,2023-07-27 11:05:39
5078,"The error log ""Unable to unfreeze entry... "" loop forever when sentinel slave pod IP in k8s changed",closed,2023-06-02 05:01:36,2023-07-27 11:05:59
5077,RemoteService can't transfer response from server to client w/JsonJacksonCodec,closed,2023-06-02 04:35:59,2023-06-02 06:47:40
5076,RStream.read blocks indefinitely if the stream is empty,closed,2023-06-01 19:09:56,2023-06-05 06:23:19
5075,Fix code scanning alert - Deserialization of user-controlled data,closed,2023-06-01 07:07:28,2023-06-01 07:07:38
5074,Add firstEntry() and lastEntry() methods to RScoredSortedSet,closed,2023-05-31 12:00:05,2023-05-31 12:00:25
5073,Not support Quarkus dev hot reload?,open,2023-05-31 08:11:33,2023-07-12 09:14:38
5072,KryoCodec Issue with Redisson 3.21.3 in Multi-thread Environment,closed,2023-05-30 12:57:29,2023-06-05 15:24:00
5070,"Redisson concurrent locking may occasionally cause one of the threads to acquire a timeout, resulting in lock failure",open,2023-05-30 03:13:05,2023-06-01 12:05:18
5069,Redisson is shutdown,closed,2023-05-29 09:01:12,2023-06-15 10:04:42
5068,Bump spring-boot-autoconfigure from 3.0.2 to 3.0.7 in /redisson,closed,2023-05-26 22:14:49,2023-05-27 04:13:20
5067,Inconsistency in behavior between redissonReactiveClient and redissonClient when using getPermitExpirableSemaphore,closed,2023-05-26 10:56:43,2023-07-04 07:57:07
5066,"Why is there no validation in the release method of RedissonSemaphore, and instead it directly performs an incr action?",closed,2023-05-26 02:18:05,2023-06-05 07:29:52
5065,Introduce fallback option for Apache Tomcat,open,2023-05-25 17:08:24,2023-05-25 17:08:24
5064,Add RMultimap.fastRemoveValue() method,closed,2023-05-25 10:17:46,2023-05-25 10:29:11
5063,Redis based Hibernate Cache implementation very slow using RedissonRegionFactory ,closed,2023-05-25 07:34:18,2023-06-05 07:30:02
5062,Memory leak Tomcat 8.5.45 or Tomcat 9.0.73,closed,2023-05-24 14:17:20,2023-06-29 05:52:21
5061,Getting IllegalMonitorStateException for RMapCache Read,closed,2023-05-24 10:47:09,2023-07-03 05:36:17
5060,"The RedissonRateLimiter has limited support for dynamically updating the rate and interval parameters, which is not very user-friendly.",open,2023-05-23 14:46:40,2023-05-23 14:46:40
5059,Not able to connect to AWS Memory DB,closed,2023-05-23 14:14:54,2023-05-26 10:00:00
5057,Unable to get the data of session object,closed,2023-05-23 05:47:14,2023-06-29 05:58:08
5056,Spring Boot 3.1 to support RedisProperties new structure,closed,2023-05-22 16:26:09,2023-05-23 10:42:27
5055,About RLongAdder Use，redisson how and when to clean the 'semaphore' key,closed,2023-05-22 03:12:23,2023-05-22 04:21:37
