Issue Number,Title,State,Created At,Updated At
3904,redisson print slots added and slots removed when application run a period of time,closed,2021-10-21 03:09:07,2022-02-18 14:02:36
3903,RBatch to execute MULTI key operations across different key slots as single command similar to RBuckets get,open,2021-10-20 21:08:35,2021-10-20 23:37:24
3902,TransferQueue blocks connection for poll,open,2021-10-20 20:01:54,2023-05-15 14:13:58
3901,"Performing a GET on an existing key, which is set outside Redisson, returns `Unsupported protocol version 53`",closed,2021-10-20 15:35:23,2021-10-21 03:37:45
3900,RRateLimit 限流器使用到的Lua脚本在阿里云集群版Redis无法执行有没有解决方案？,closed,2021-10-20 11:45:02,2021-10-22 07:25:06
3899,Added new SMISMEMBER command,closed,2021-10-19 09:46:58,2022-12-21 06:58:02
3898,BloomFilter false judgment does not meet expectations,closed,2021-10-19 01:31:40,2023-06-27 07:15:06
3897,AWS Elasticache Redis Replicated server and master failover,closed,2021-10-18 17:34:08,2021-10-27 05:40:18
3896,RMapCache#addListener method；Obtain the operating system type is null,closed,2021-10-18 07:24:46,2021-10-18 07:46:38
3895,java.lang.StackOverflowError in releaseConnection,closed,2021-10-17 20:46:46,2021-10-19 06:28:17
3894,RBloomFilter batch and async mode,open,2021-10-15 13:30:53,2021-10-15 13:30:53
3893,RBucket get block,closed,2021-10-15 07:30:44,2023-07-03 06:40:27
3892,Is RBatch a single get/put call to Redis server using MGET/MSET functionality,closed,2021-10-14 21:25:25,2021-10-20 05:56:41
3891,Concurrent attempt to RReadWriteLock writeLock leaves thread in blocked state after lock is released.,open,2021-10-14 15:34:04,2021-10-14 15:34:04
3890,Redis keep the keys even if they are expired,closed,2021-10-14 12:53:51,2021-10-21 12:45:27
3889,Unreleased Resources,closed,2021-10-14 01:35:57,2021-10-22 04:07:44
3888,Regression in 3.16.3 fails EVALSHA operation on multiple-shard Redis Cluster with authenticated connections,closed,2021-10-13 17:11:40,2021-10-20 23:22:06
3887,Unable to send PING command over channel: L:/127.0.0.1:65454 - R:localhost/127.0.0.1:7000,closed,2021-10-13 11:39:10,2021-10-19 01:58:55
3886,Low ScanInterval burns CPU  ,closed,2021-10-13 08:13:27,2021-10-14 07:54:24
3885,RListMultimapCache & RSetMultimapCache is not available for RedissonReactiveClient,closed,2021-10-12 23:56:12,2021-11-11 12:38:35
3884,Netty memory leak error,closed,2021-10-12 15:37:02,2023-07-14 14:07:20
3883,Systematic timeouts since 3.16.1,closed,2021-10-12 14:38:14,2021-11-08 10:36:11
3882,"I am using the ""redisson-spring-boot-starter"" dependency to read the yaml file and encountered some problems",closed,2021-10-12 12:35:50,2021-10-22 04:07:59
3881,Transaction.commit,closed,2021-10-12 11:35:26,2022-04-18 06:30:34
3880,IndexOutOfBoundsException on reading PENDING Array[Byte] message,closed,2021-10-12 09:49:36,2021-10-15 06:03:35
3879,"How does ""RedisTimeoutException: Unable to get connection! Try to increase 'nettyThreads' and/or connection pool size settingsNode source"" happen",closed,2021-10-12 08:36:18,2021-10-12 09:07:27
3878,Chinese document of chapter 7 has a mistake.,closed,2021-10-12 06:22:14,2023-07-03 06:40:06
3877,NPE in CommandPubSubDecoder.messageDecoder,closed,2021-10-11 17:08:23,2021-10-12 11:41:30
3876, Unable to get connection! Try to increase 'nettyThreads' and/or connection pool size settingsNode source,closed,2021-10-11 08:19:30,2021-10-11 09:35:25
3875,redis-sentinel connection with ssl not working as expected,closed,2021-10-10 10:43:09,2021-11-16 09:28:30
3874,"use LocalCachedMapOptions.SyncStrategy.UPDATE,Perform put(), remove(), and get() operations in order, I got the value of put()",closed,2021-10-09 10:05:12,2021-11-08 12:26:02
3873,Reddison 3.16.3 is using netty-common 4.1.68.Final and netty-handler 4.1.68.Final but when I upgrade latest version of reddison is still using netty 4.1.66 version,closed,2021-10-08 18:36:47,2023-01-05 16:43:00
3872,JSON is not bad and yaml is not supposed to be only way,closed,2021-10-08 14:08:24,2021-11-05 14:35:26
3871,Connection Leak,closed,2021-10-07 22:22:56,2021-10-20 06:03:40
3870,How to get notified when the key has been expired by TTL,closed,2021-10-07 09:29:53,2021-10-08 06:31:42
3869,org.redisson.client.RedisResponseTimeoutException: Redis server response timeout when use RLock,closed,2021-10-06 15:27:39,2021-10-21 06:50:43
3868,Exception on heavy load in springboot,closed,2021-10-06 12:16:30,2021-10-22 07:19:05
3867,Version 3.16.3: RedisTimeoutException: Command execution timeout for command: (PING),closed,2021-10-06 08:57:46,2022-03-17 06:50:47
3866,JCache does not call onExpired event at expired cache event.,closed,2021-10-05 13:48:54,2021-10-15 05:38:14
3865,Unable to register multiple Reference codecs in RedissonClient ,closed,2021-10-04 18:15:46,2023-07-12 11:03:58
3864,How to add value synchronous on RedissonPriorityQueue?,closed,2021-10-04 13:13:48,2021-10-05 11:23:07
3863,redisson-spring-boot-starter has compile time dependency on test artifacts (junit and assertj),closed,2021-10-04 12:30:18,2021-10-06 08:48:32
3862,RTransaction::getBucket returns different instances on subsequent calls to the same transaction,closed,2021-10-04 12:11:12,2022-10-14 07:34:33
3861,Quarkus extension seems to only use config from build time,closed,2021-10-04 11:35:27,2022-01-20 12:42:02
3860,How does PING influences the BATCH command?,closed,2021-10-04 09:42:08,2021-10-05 08:23:35
3859,Redisson getLock operation does not respect timeout,closed,2021-10-04 08:43:33,2021-10-12 11:54:38
3858,when use CompletableFuture.runAsync to create thread we got no class definition found from redisson ,closed,2021-10-03 14:54:21,2021-10-22 07:21:15
3857,Tomcat Servers Crashes due to SIGSEV with Redisson 3.10.0,closed,2021-10-01 16:24:43,2021-10-12 11:47:23
3856,Redisson Crashes Tomcat server  ,closed,2021-10-01 16:20:07,2021-10-01 16:22:50
3855,How to add custom tags to Redisson metrics,closed,2021-10-01 11:21:46,2021-10-03 05:49:56
3854,How to get notified of an expired lock lease?,open,2021-09-29 22:36:28,2023-05-19 09:35:46
3853,How to extend the valid time of tomcat session?,closed,2021-09-29 03:24:58,2021-09-29 08:26:07
3852,RLockReactive tryLock waits longer than waitTime,closed,2021-09-28 14:59:08,2021-09-28 18:56:02
3851,redisson-hibernate fails to load config when running in Quarkus dev mode,closed,2021-09-28 01:30:14,2022-01-27 08:37:46
3850,Redisson should not retry on non idempotent operations,closed,2021-09-27 16:52:21,2021-10-14 07:51:20
3849,Master slave mode vs Replicated mode,closed,2021-09-27 07:06:53,2021-09-29 10:14:03
3848,Lock info,open,2021-09-26 13:44:51,2021-09-26 13:45:30
3847,Lock info fixed,closed,2021-09-25 20:54:35,2021-09-25 21:13:02
3846,Reddison Fuzzy matching iteration is too time-consuming,closed,2021-09-25 06:39:24,2021-09-29 08:25:12
3845,EntryXXXListener is not working on Turkish language Windows 10,open,2021-09-24 15:01:31,2021-09-29 10:33:10
3844, keys.getKeysByPattern cost too much time,closed,2021-09-23 08:00:56,2021-09-23 09:24:08
3843,Unexpected exception while processing command,closed,2021-09-23 02:25:05,2021-10-22 07:26:07
3842,How can I execute BGREWRITEAOF command from RedissonClient?,closed,2021-09-22 16:59:45,2021-09-23 17:30:06
3841,RMapCache.fastRemove throws RedisException: too many results to unpack,closed,2021-09-22 10:55:47,2021-09-24 05:58:40
3840,Connection leak (regression since 3.16.1),closed,2021-09-20 08:50:13,2021-09-23 09:29:13
3839,Stream - DS,closed,2021-09-19 23:26:36,2021-09-24 13:52:24
3838,How does spring boot1.5x upgrade the redisson version from 3.8.x to 3.11.x?,closed,2021-09-19 05:07:45,2021-09-20 09:43:54
3837,can i disable AddressResolverGroupFactory,closed,2021-09-18 09:20:27,2021-10-08 06:52:30
3836,spring boot 2.4.10 with redisson 3.16.2 : zadd command will throw stackoverFlow error,closed,2021-09-17 10:54:43,2021-09-17 12:59:44
3835,I expect to receive a delayed message without pushing a new or null data to the delay queue,closed,2021-09-17 10:14:15,2021-10-22 07:17:50
3834,Inconsistent Performance Retrieving Data From Redis with Redisson,closed,2021-09-17 00:35:33,2021-09-24 06:21:18
3833,Pub Sub connections being initialised repeatedly after redis server VM became unresponsive,closed,2021-09-16 16:30:53,2021-09-22 06:56:53
3832,Multiple connection pools created to failover slave while redis server rebooted,closed,2021-09-16 16:21:43,2021-09-22 06:57:12
3831,如何使用 jasypt 加密配置,closed,2021-09-16 03:08:55,2021-09-16 07:14:27
3830,Unable to send PING during load test,closed,2021-09-14 16:51:37,2021-09-22 15:27:27
3829,RedissonFairLock does not automatically clear non-running LockName and non-reference lock methods after a restart and cannot be automatically renewed,open,2021-09-13 11:07:20,2021-09-13 11:10:20
3828,RedissonV3.16.2 write null command to slave node when use epoll transportMode,closed,2021-09-10 02:50:43,2021-10-04 07:00:36
3827,Question about ConnectionListener with AWS ElastiCache for Redis,closed,2021-09-10 00:42:48,2021-12-22 07:46:30
3826,"Fix ""TryLock interrupted keeps renewing lock indefinitely""",closed,2021-09-09 18:21:52,2021-09-13 06:22:56
3825,Question about use of Redisson againt Azure Cache for Redis,closed,2021-09-09 13:49:03,2021-09-24 08:46:12
3824,"[question] 3 node SENTINEL init fails with ""SENTINEL SENTINELS command returns less than 2 nodes""",closed,2021-09-09 08:05:46,2021-09-22 06:59:25
3823,"fix: ""bitfield xx get ix index"" can only work on master node",closed,2021-09-09 06:13:52,2021-11-03 02:42:01
3822,bitfield xx get i8 :READONLY You can't write against a read only slave,closed,2021-09-09 02:43:37,2021-11-02 13:37:35
3821,RedissonLock Perhaps leak,closed,2021-09-08 10:30:07,2021-09-13 07:07:47
3820,Lambda task not work as expect in RExecutorService,open,2021-09-08 06:03:15,2023-05-19 09:35:45
3819,Hostname ends up comparing against IP address,closed,2021-09-07 13:21:54,2021-09-08 17:05:27
3818,fix: fix bug for mset cross slot (miss values except cluster mode),closed,2021-09-07 12:40:57,2021-09-10 13:02:07
3817,"HINCRBYFLOAT  java.lang.NumberFormatException: For input string: ""PONG""",closed,2021-09-07 06:38:24,2021-09-20 09:21:49
3816,RedissonMapCache.addListener() throw java.lang.NullPointerException,closed,2021-09-07 02:18:50,2021-09-07 07:23:14
3815,"Curious to ask, why deprecate the json configuration ?",closed,2021-09-06 09:24:43,2021-09-07 07:23:28
3814,RExecutorService sometime will stuck and does not resume task anymore,closed,2021-09-06 03:48:10,2021-09-21 07:09:51
3813,why send may command when use mget command and all keys in same slot?,closed,2021-09-04 09:45:24,2021-09-06 12:04:18
3812,RExecutorService execute same task twice at the same time,closed,2021-09-03 09:57:30,2021-10-10 10:06:06
3811,Why does RCountDownLatch not implement the RExpirable interface?,open,2021-09-03 03:12:26,2021-09-03 03:12:26
3810,"mset command (getBuckets().set(Map<String, ?>)) in redis cluster throw CROSSSLOT",closed,2021-09-03 02:45:46,2021-09-07 05:15:27
3809,Failed to submit a listener notification task. Event loop shut down?,closed,2021-09-02 07:56:25,2021-09-02 09:20:09
3808,CommandDecoder: Unable to decode data. channel command: (EXISTS) java.lang.ClassCastException: java.lang.String cannot be cast to java.lang.Long,closed,2021-09-02 03:37:58,2021-09-24 06:19:43
3807,port out of range:-1 if host is starting with slash,open,2021-09-01 13:09:32,2021-09-01 13:09:32
3806,Create custom Trim parameter class and overload the trim methods,closed,2021-09-01 12:30:48,2021-09-03 06:53:06
3805,Redis hostnames support for Sentinel mode,closed,2021-09-01 07:58:58,2021-09-07 14:14:21
3804,RRateLimiter drift,closed,2021-08-31 11:59:13,2021-09-23 08:30:18
3803,Redis Stream XTRIM with MINID strategy is not fully supported: incompatible parameter type,closed,2021-08-31 10:46:04,2021-09-03 06:52:32
3802,RMapCache HMGET notworking,closed,2021-08-31 08:49:59,2021-09-03 07:31:42
3801,Access Denied on Javadoc Search,closed,2021-08-28 22:00:41,2021-09-14 06:56:17
3800,RMap.loadAll() probably should clear unexistent entries.,open,2021-08-27 20:07:22,2021-08-27 20:07:22
3799,RedissonSemaphore#trySetPermitsAsync lua script is wrong ? ,closed,2021-08-27 07:55:24,2021-09-14 06:58:57
3798,class loader exception,closed,2021-08-26 12:12:50,2021-09-16 07:22:20
3797,redisson currently does not fully support the redis lpush command,closed,2021-08-26 07:29:32,2021-09-02 06:06:53
3796,DRAFT: Fix Sentinel setup with resolve-hostnames enabled,closed,2021-08-24 15:52:41,2021-10-22 06:55:25
3795,Why does redisson always reconnect the old redis pod ip?,closed,2021-08-24 03:00:12,2022-09-08 08:07:32
3794,Fix Sentinel setup with dynamic redis IPs for hostnames,closed,2021-08-23 18:41:58,2021-08-23 20:43:51
3793,exception class loader ,closed,2021-08-23 08:49:00,2021-08-26 12:09:55
3792,Deserialization difference between RedissonMap and RedissonLocalCachedMap,closed,2021-08-21 05:58:53,2021-08-24 05:55:50
3791,为什么集群部署连接显示检测插槽未满,closed,2021-08-21 03:25:20,2021-08-21 04:15:53
3790,Why Redission session manager stopped working after new virtual host in Tomcat,closed,2021-08-21 02:06:20,2021-09-23 05:42:17
3789,MacOSDnsServerAddressStreamProvider,closed,2021-08-20 15:35:25,2021-08-24 05:17:56
3788,"Post slave-recovery , GetType commands continue to being sent to master node instead of slave nodes ",closed,2021-08-20 10:42:44,2021-09-23 05:41:34
3787,spring cache and jackson InvalidDefinitionException,closed,2021-08-20 08:22:15,2021-08-20 08:48:08
3786,Micronaut 3.0.0 integration,closed,2021-08-20 07:21:44,2021-08-20 07:24:34
3785,org.redisson.client.RedisException: ERR invalid cursor. channel,closed,2021-08-20 07:19:42,2021-08-23 07:43:58
3784,Delay queue message loss,closed,2021-08-19 11:30:34,2021-08-25 05:58:08
3783,RedissonKeys.Delete() method pass empty array will block the thread in redis cluster,closed,2021-08-19 10:01:37,2021-08-20 06:09:38
3782,enchancements: native mode ,closed,2021-08-17 18:47:31,2021-08-18 10:55:36
3781,`RedisNodeNotFoundException` still exists when redis cluster fail over,open,2021-08-17 05:57:19,2021-09-27 13:00:21
3780,The return value of this method about setIfAbsent is null.,closed,2021-08-15 08:02:53,2021-08-18 08:24:35
3779,TransportMode,closed,2021-08-15 07:04:49,2021-08-16 01:46:59
3778,Listeners unregistered,open,2021-08-15 01:22:06,2021-11-21 12:20:27
3777,Topic listener removal,closed,2021-08-14 20:32:10,2021-08-15 20:49:11
3776,RPriorityBlockedQueue takes element even after the calling thread has been interrupted,open,2021-08-13 14:26:42,2023-05-19 09:35:45
3775,nginx PROXY redis,closed,2021-08-13 10:22:49,2021-08-15 07:03:20
3774,quarkus-redisson: a static analysis issue mentioning bytebuddy,closed,2021-08-12 14:07:51,2021-09-02 06:42:13
3773,Add batched merge() method to RLiveObjectService interface,closed,2021-08-12 07:34:07,2021-08-12 07:34:55
3772,fixing spelling in wiki,closed,2021-08-11 18:04:04,2021-11-08 10:42:32
3771,Exceptions when changing node type in AWS Elasticache on the fly,closed,2021-08-11 15:17:28,2022-08-30 15:42:56
3770,enchancements redisson-quarkus-20 native mode and config,closed,2021-08-11 11:19:19,2021-08-18 10:55:25
3769,"Is there a way to pass redis commands in redisson, without using the functions?",closed,2021-08-11 07:36:26,2021-08-11 09:30:14
3768,Flushing write-behind tasks,closed,2021-08-10 04:56:52,2021-08-10 07:30:30
3767,RedissonReactiveClient limitations,closed,2021-08-10 01:20:44,2022-11-10 06:29:45
3766,Redis operations metrics,closed,2021-08-10 01:15:13,2023-07-03 06:42:28
3765,Does near cache options also apply to the backing RMap?,closed,2021-08-10 01:11:47,2021-08-10 06:50:00
3764,"redisson-spring-boot-starter support ""spring.redis.url""",open,2021-08-09 12:46:37,2021-08-09 12:46:37
3763,Redisson No Session in spring app on tomcat ,closed,2021-08-05 13:03:13,2021-10-22 07:25:38
3762,Issue when testing failover on AWS Elaticache,closed,2021-08-05 08:11:24,2022-04-18 06:46:27
3761,RedissonMapCache#addListener with Redis Sentinel may cause NOPERM exception,open,2021-08-04 13:54:42,2021-08-04 13:54:42
3760,Fix primary update condition for cluster mode.,closed,2021-08-03 23:58:57,2021-08-05 04:06:06
3759,Redis Stream Support For Spring Applications,open,2021-08-03 14:13:55,2023-05-19 09:35:44
3758,java.lang.ExceptionInInitializerError: null,closed,2021-08-03 13:34:01,2021-08-23 11:25:43
3757,java.lang.NullPointerException,closed,2021-08-03 10:33:20,2021-08-04 01:49:17
3756,the method  RRateLimiter.expire() is incorrect working,closed,2021-08-03 02:45:59,2021-08-03 06:24:07
3755,Redisson throwing java.io.NotSerializableException when trying to publish something in a topic,closed,2021-08-02 21:18:34,2021-08-03 06:18:59
3754,Is there any guideline for upgrading the middle value of a version,closed,2021-08-02 05:14:11,2021-08-05 07:43:14
3753,Simplify code using Map::computeIfAbsent,closed,2021-07-31 00:56:41,2021-08-06 09:49:43
3752,Different effects when Mix using of multiLock and Lock,open,2021-07-30 10:38:17,2021-07-30 10:40:34
3751,RDeque Or RPriorityDeque Lost data,closed,2021-07-30 10:04:50,2021-08-02 08:57:56
3750,redis lock not working as expected,closed,2021-07-30 07:36:38,2021-10-26 12:29:39
3749,RedisTimeoutException following RedisLoadingException,closed,2021-07-28 16:02:54,2021-09-06 10:45:50
3748,sslProtocols parse issue,closed,2021-07-28 12:56:10,2021-08-02 09:41:16
3747,Regression - quarkus native builds fail after updating netty in 3.16.1,closed,2021-07-27 15:01:41,2021-08-16 08:27:26
3746,not consistent response,closed,2021-07-27 08:39:55,2021-08-03 06:41:17
3745,Command still hasn't been written into connection!,closed,2021-07-26 07:59:07,2021-08-24 05:24:08
3744,mget improvement,closed,2021-07-24 17:13:57,2021-07-24 17:56:20
3743,Class cast exceptions on CommandsData,closed,2021-07-24 08:34:11,2021-07-26 07:37:03
3742,update Netty to 4.1.66.Final,closed,2021-07-23 10:54:49,2021-07-25 06:42:51
3741,RedissonClient.getList() performance,closed,2021-07-23 06:55:45,2021-07-23 10:36:13
3740,mget,closed,2021-07-23 02:56:02,2021-07-23 03:17:42
3739,Question about Redisson pub/sub listeners not re-subscribing after Redis maintenance,closed,2021-07-22 13:01:50,2021-09-14 06:09:20
3738,Batch check the existence of keys in RedissonMap,closed,2021-07-22 11:48:55,2021-07-23 14:19:14
3737,data consistency,closed,2021-07-22 02:24:09,2021-07-30 03:20:10
3736,Issue with AWS Elasticache using ReplicatedConfig when failover,closed,2021-07-21 10:58:15,2022-05-30 11:44:37
3735,ClassNotFoundException Exception RemoteServiceResponse,closed,2021-07-19 15:57:38,2021-08-02 09:52:53
3734,Predicate filter on RListReactive list returns non-deterministic result,closed,2021-07-18 22:09:52,2021-08-03 11:20:08
3733,Redisson connections release while command execution attempt failed,closed,2021-07-16 13:58:29,2021-08-03 06:56:35
3732,Can't parse json config /tomcat/redisson.conf,closed,2021-07-14 19:16:16,2021-07-20 00:30:33
3731,Dynamic cache name when using with spring boot,closed,2021-07-14 08:10:46,2021-07-14 11:18:14
3730,FairLock deadlock again,closed,2021-07-14 02:39:21,2021-08-02 09:53:43
3729,"ReactiveRedissonTransactionManager`s transactionOption change, but not work",closed,2021-07-13 14:04:08,2021-08-02 10:01:58
3728,Thread lock starvation with RSemaphore on high concurrency with hundreds of locks (2),closed,2021-07-13 05:20:08,2021-08-28 09:46:44
3727,RMapCache,closed,2021-07-12 07:36:47,2021-07-27 04:57:04
3726,Redisson mget性能问题,closed,2021-07-12 04:00:30,2021-07-27 04:57:41
3725,"org.redisson.client.RedisConnectionClosedException: Command (EVAL), params: [if (redis.call('hexists', KEYS[1], ARGV[2]) == 1) then redis.call('pexpire', KEYS[1], ARGV[1]); retu..., 1, * * :10, 30000, 961d0a00-de8f-4176-935d-c4b7a71b17e8:911] succesfully sent, but channel [id: 0x96383] has been closed!",closed,2021-07-10 06:58:50,2021-07-27 04:58:03
3724,"Ask a lock reentry problem, sub method using thread pool call",closed,2021-07-10 01:54:54,2021-07-12 12:08:26
3723,ByteBuf leak when RedissonScoredSortedSet addAll,closed,2021-07-09 14:46:48,2023-07-03 06:42:42
3722,Redisson - JDK 16,closed,2021-07-09 13:49:18,2021-07-09 13:56:11
3721,Pub-sub is not working if custom name mapper is defined,closed,2021-07-09 09:00:16,2021-07-14 07:03:43
3720,RDelayedQueue doesn't return element when there is only one element in queue ,closed,2021-07-09 08:32:14,2021-10-27 12:33:54
3719,org.redisson.client.WriteRedisConnectionException: Unable to write command into connection! Node source: NodeSource,closed,2021-07-09 04:47:02,2022-05-24 09:32:10
3718,org.redisson.client.WriteRedisConnectionException: Unable to write command into connection! Node source: NodeSource,closed,2021-07-09 03:42:21,2023-04-12 09:10:38
3717,Kotlin objects with JsonJacksonCodec ,closed,2021-07-06 22:39:29,2021-09-06 10:46:04
3716,Fix expiration release,closed,2021-07-06 18:04:45,2021-07-15 08:01:45
3715,lock released,closed,2021-07-06 15:42:56,2021-07-06 16:45:49
3714,Redis renewExpiration  ttl problem,closed,2021-07-06 14:50:35,2021-07-15 08:02:03
3713,Unsupported protocol version 50,closed,2021-07-06 03:59:26,2021-07-06 09:42:21
3712,Redisson renewExpiration not working after redis lock expires,closed,2021-07-05 17:33:08,2021-07-05 18:05:44
3711,org.redisson.client.RedisException: Unexpected exception while processing command,closed,2021-07-05 16:39:23,2021-08-03 06:43:08
3710,Live object batch persist error,closed,2021-07-05 13:31:58,2021-08-06 11:06:23
3709,Add value to RSet with KEEPTTL option,closed,2021-07-05 10:58:21,2021-07-05 11:32:23
3708,请教一个锁重入问题，子方法使用线程池调用,closed,2021-07-05 07:18:33,2021-07-09 08:08:51
3707,Allow to set task id for RScheduledExecutorService,closed,2021-07-04 14:45:53,2022-07-07 07:06:36
3706,Quarkus native remote service invocation fails,closed,2021-07-02 22:54:32,2021-07-13 09:34:31
3705,Azure Redis For Cache. Scheduler stops fire timeouts after redis restart,closed,2021-07-01 09:50:37,2021-08-03 06:56:47
3704,Redisson vs Lettuce - Performance Comparison,closed,2021-06-30 20:18:17,2021-08-03 14:20:42
3703,cannot get redis connection after redis master switch over and found there're memory leak.,closed,2021-06-30 09:55:27,2021-07-24 07:24:48
3702,Provide Redisson commandExecutor instrumentation,open,2021-06-30 07:23:34,2022-02-16 03:42:42
3701,Transaction support for other DS,closed,2021-06-30 04:17:25,2021-06-30 20:23:24
3700,Stream API enhancement,closed,2021-06-29 22:50:03,2021-07-14 07:16:22
3699,Stream - do not emit empty map,open,2021-06-29 20:58:36,2023-05-19 09:35:44
3698,Redisson - remove web dependency. conflicts with WebFlux,closed,2021-06-29 14:26:44,2021-06-30 08:26:34
3697,Getting UndeclaredThrowableException when cache down while doing rlos.get(),closed,2021-06-29 12:14:16,2021-06-30 08:48:16
3696,ClusterPartition#slotRanges not update in ClusterConnectionManager#checkSlotsMigration ,closed,2021-06-29 07:59:45,2021-06-29 10:25:59
3695,The ClusterPartition#slotRanges not update in ClusterConnectionManager#checkSlotsMigration,closed,2021-06-29 03:57:39,2021-06-29 10:25:51
3694,Redisson Pro ,closed,2021-06-29 00:29:40,2021-06-29 07:34:29
3693,Redisson Spring Boot Starter is missing CacheManager,closed,2021-06-28 23:30:00,2021-07-27 05:31:11
3692,Redisson complains about multiple masters when two replicated address nodes resolve to the same IP,closed,2021-06-28 21:57:18,2021-08-12 06:25:13
3691,"Error message from Redis: ERR invalid command channel: [id: 0x33948139, L:/10.0.3.228:40080 - R:/172.16.1.9:6379]",closed,2021-06-28 12:42:11,2021-06-30 08:26:01
3690,"Is there any instruction to build the project, thanks",closed,2021-06-27 01:40:38,2021-07-29 10:07:37
3689,redisson crashing ,closed,2021-06-26 18:45:15,2021-07-27 13:54:45
3688,fix ClusterConnectionManager#checkSlotsMigration map slot-partitions bug after re-sharding slots,closed,2021-06-26 13:37:59,2021-06-28 07:02:37
3687,AUTH does not seem to work as expected.,closed,2021-06-25 20:05:37,2021-07-14 06:52:45
3686,How should users debug subscription timeouts? ,open,2021-06-25 18:19:38,2023-05-19 09:35:43
3685,MOVED redirection loop detected on AWS Elasticache,closed,2021-06-25 16:03:39,2021-06-27 15:49:05
3684,Connecting to AWS Elasticache cluster using cluster endpoint,closed,2021-06-25 15:02:17,2021-06-25 18:05:31
3683,中文的wiki中关于分布式服务相关章节，缺少对woker相关描述，希望补全,closed,2021-06-25 08:13:53,2023-07-03 06:42:54
3682,Redisson LOS retry configuration,closed,2021-06-24 20:20:22,2021-06-25 05:13:16
3681,Configure Sentinel on Kubernetes using bitnami/redis,closed,2021-06-24 15:53:13,2021-09-24 08:29:35
3680, I want to listen to the redis link disconnection event,closed,2021-06-24 13:29:50,2021-06-29 07:06:53
3679,关于分布式调度有个疑问需要咨询一下,closed,2021-06-24 12:43:59,2021-07-05 07:30:37
3678,RScheduledExecutorService tasks not run(or run only a part),closed,2021-06-24 03:41:35,2021-07-26 06:47:35
3677,class not found exception with redisson tomcat code,closed,2021-06-23 14:48:03,2021-08-23 08:56:26
3676,Fix NPE thrown by RedisURI.compare(),closed,2021-06-23 09:23:25,2021-08-20 06:19:57
3675,'Not all slots covered!' on startup in AWS Elasticache,closed,2021-06-21 10:39:59,2021-06-28 08:31:14
3674,Transaction does not execute,closed,2021-06-20 22:59:14,2021-07-01 12:59:11
3673,RBlockingDequeReactive does not consume all elements,closed,2021-06-20 16:44:18,2021-06-22 06:47:16
3672,MapLoader / MapWriter Reactive Interface,open,2021-06-19 22:41:09,2022-03-28 04:28:43
3671,getLocalCachedMap for reactive client,closed,2021-06-19 20:20:04,2022-11-10 06:29:06
3670,Reactive Client - Key does not expire,closed,2021-06-19 16:43:45,2021-06-21 09:08:01
3669,Can't set expiration time for bloomFilter key?,closed,2021-06-19 16:29:58,2021-09-06 10:47:22
